,created_at,tweet,user_name,weekday,month,day,at_risk
7865,05:13:45,dudes dead wrong history like aha upset tankies get call,Kaimandante,Mon,Mar,15,1
7866,05:13:45,imagine eat share alcoholic drink home cuddle damn would fuckin nice,lPancho_,Mon,Mar,15,1
7867,05:13:43,mobile operator internet data cut myanmar limitless hear wifi cut soon daily dead rate,aein_pyae,Mon,Mar,15,1
7868,05:13:43,truly beastly take care animals humans,SFCryptoRounder,Mon,Mar,15,1
7869,05:13:42,believe channel terminate mistake file appeal,TeamYouTube,Mon,Mar,15,1
7870,05:13:41,mobile operator internet data cut myanmar limitless hear wifi cut soon daily dead rate,YeBhoneHein1,Mon,Mar,15,1
7871,05:13:39,give dude respect,e_m_d22,Mon,Mar,15,1
7872,05:13:38,mobile operator internet data cut myanmar limitless hear wifi cut soon daily dead rate,AbelAung1,Mon,Mar,15,1
7873,05:13:37,trap wall tunnel captives yearn set free soulful sigh echo night residents stay,BridgitteLesley,Mon,Mar,15,1
7874,05:13:35,write article last november variety reason take till publish explore four many,bgin_global,Mon,Mar,15,1
7875,05:13:33,probably would dead week case stand house people fact,SpidenHerd,Mon,Mar,15,1
7876,05:13:33,mobile operator internet data cut myanmar limitless hear wifi cut soon,HNuynt,Mon,Mar,15,1
7877,05:13:31,mobile operator internet data cut myanmar limitless wifi cut soon daily dead rate,PhyuYiMon,Mon,Mar,15,1
7878,05:13:30,mobile operator internet data cut myanmar limitless hear wifi cut soon daily dead rate,KyalSin71731797,Mon,Mar,15,1
7879,05:13:27,mobile operator internet data cut myanmar limitless hear wifi cut soon daily dead rate,PhooNayChiKyaw1,Mon,Mar,15,1
7880,05:13:26,mobile operator internet data cut myanmar limitless hear wifi cut soon daily dead rate,ThunThwe,Mon,Mar,15,1
7881,05:13:25,mobile operator internet data cut myanmar limitless hear wifi cut soon daily dead rate,AmeTheint,Mon,Mar,15,1
7882,05:13:24,mobile operator internet data cut myanmar limitless hear wifi cut soon daily dead rate,Moezin5281,Mon,Mar,15,1
7883,05:13:23,mobile operator internet data cut myanmar limitless hear wifi cut soon daily dead rate,htetaungyeyin16,Mon,Mar,15,1
7884,05:13:21,mobile operator internet data cut myanmar limitless hear wifi cut soon daily dead rate,SuSu42793908,Mon,Mar,15,1
7885,05:13:19,yes horrify beast accuse grow tire back whatever reaso,ariwrote,Mon,Mar,15,1
7886,05:13:16,mobile operator internet data cut myanmar limitless hear wifi cut soon dail,MyoMinK92807549,Mon,Mar,15,1
7887,05:13:16,mobile operator internet data cut myanmar limitless hear wifi cut soon dai,AbelAung1,Mon,Mar,15,1
7888,05:13:16,probably shake pant like humpty dumpty trump insult,RickyTn,Mon,Mar,15,1
7889,05:13:15,yesterday march alone people report dead myanmar many unconfirmed deaths injuries,9UBKxRaapsxIzFS,Mon,Mar,15,1
7890,05:13:14,mobile operator internet data cut myanmar limitless hear wifi cut soon daily dead rate,Hoto53717206,Mon,Mar,15,1
7891,05:13:09,blood citizens market junta fire market morning myingy,Thandar02681730,Mon,Mar,15,1
7892,05:13:07,andrew bolt trend please let dead,Ecoludologist,Mon,Mar,15,1
7893,05:13:06,thank send way feature add audio videos,TeamYouTube,Mon,Mar,15,1
7894,05:13:06,mobile operator internet data cut myanmar limitless hear wifi cut soon daily dead rate,mis_linnn,Mon,Mar,15,1
7895,05:13:05,patch pain til dead,BgLuhMeezy,Mon,Mar,15,1
7896,05:13:04,mobile operator internet data cut myanmar limitless hear wifi cut soon daily dead rate raise,MyaMyitzu4,Mon,Mar,15,1
7897,05:13:02,mobile operator internet data cut myanmar limitless hear wifi cut soon daily dead rate,HsuMyat80378921,Mon,Mar,15,1
7898,05:13:02,mobile operator internet data cut myanmar limitless hear wifi cut soon daily dead rate,LawlietSalai,Mon,Mar,15,1
7899,05:13:02,wow grammys give tingle vibes get live show wait live music back,ramrparimi,Mon,Mar,15,1
7900,05:13:00,scalp felony try get digimon card game product,SynisterJames,Mon,Mar,15,1
7901,05:12:58,give dude respect,JVMES4152,Mon,Mar,15,1
7902,05:12:56,amazingly strong brave courageous even age really nee,ArielleNugent,Mon,Mar,15,1
7903,05:12:54,mobile operator internet data cut myanmar limitless hear wifi cut soon daily dead rate,tpthandar2021,Mon,Mar,15,1
7904,05:12:49,mobile operator internet data cut myanmar limitless hear wifi cut,HNuynt,Mon,Mar,15,1
7905,05:12:49,mobile operator internet data cut myanmar limitless hear wifi cut soon daily dead rate,nyunt_pyae,Mon,Mar,15,1
7906,05:12:47,tweet mobile operator internet data cut myanmar limitless hear wifi cut soon daily,ThiHanWin10,Mon,Mar,15,1
7907,05:12:47,tryna humble,JVMES4152,Mon,Mar,15,1
7908,05:12:46,next stream play dead daylight come join get scar,EnigmaLazuli,Mon,Mar,15,1
7909,05:12:46,hear rumor rich people sign postmates drivers week get vaccines essentia,We_Be_Snackin,Mon,Mar,15,1
7910,05:12:41,mobile operator internet data cut myanmar limitless hear wifi cut soon daily dead rate,Xender241,Mon,Mar,15,1
7911,05:12:41,mobile operator internet data cut myanmar limitless hear wifi cut soon daily dead rate,ShoonYupar,Mon,Mar,15,1
7912,05:12:40,mobile operator internet data cut myanmar limitless hear wifi cut soon daily dead rate,nicholes_dier,Mon,Mar,15,1
7913,05:12:37,mobile operator internet data cut myanmar limitless hear wifi cut soon daily dead rate,ALinn70245638,Mon,Mar,15,1
7914,05:12:36,never say bill burr racist idk point,nia7kai,Mon,Mar,15,1
7915,05:12:35,question line mbs sanction,sara4SF,Mon,Mar,15,1
7916,05:12:31,tweet either lyric funny dead ass,thebighomieKG,Mon,Mar,15,1
7917,05:12:26,mobile operator internet data cut myanmar limitless hear wifi cut soon dai,AbelAung1,Mon,Mar,15,1
7918,05:12:25,mobile operator internet data cut myanmar unlimited hear wifi cut soon daily dead rate,HKonicag,Mon,Mar,15,1
7919,05:12:24,people like think failure mfs think dead loser someone get,ionoyoutellme,Mon,Mar,15,1
7920,05:12:24,hear news wifi cut today whatshappeninginmyanmar mar coup,CChan_Z,Mon,Mar,15,1
7921,05:12:22,mobile operator internet data cut myanmar limitless hear wifi cut soon daily dead rate,TharHtooSan2001,Mon,Mar,15,1
7922,05:12:21,law hour lose daylight save monday horse shit,desertseaweed,Mon,Mar,15,1
7923,05:12:21,mobile operator internet data cut myanmar limitless hear wifi cut soon,MyoMinK92807549,Mon,Mar,15,1
7924,05:12:20,mobile operator internet data cut myanmar limitless hear wifi cut soon daily dead rate,Holly66601748,Mon,Mar,15,1
7925,05:12:16,little right bullsh,bigru510,Mon,Mar,15,1
7926,05:12:15,san franola cereals,cerealsmiamiam,Mon,Mar,15,1
7927,05:12:14,blood citizens market junta fire market morning myingyan one,Thandar02681730,Mon,Mar,15,1
7928,05:12:12,take shoot every time across comment would dead,F4S1H4,Mon,Mar,15,1
7929,05:12:08,mobile operator internet data cut myanmar limitless hear wifi cut,urdarydar,Mon,Mar,15,1
7930,05:12:05,golden gate park bioluminescent like lead forest display april,SFGreatSociety,Mon,Mar,15,1
7931,05:12:05,see would dead waist would president believe,BarbakoffSteven,Mon,Mar,15,1
7932,05:12:05,mobile operator internet data cut myanmar limitless hear wifi cut soon daily dead rate,aint_myat,Mon,Mar,15,1
7933,05:12:04,beyonc jay want one show meg last one see,Dejarrrr,Mon,Mar,15,1
7934,05:12:02,axum ethiopia massacre survivor hyenas eat corpses may quho collect many dead body,JacobKushner,Mon,Mar,15,1
7935,05:12:02,sometimes twitter clean dead account bot account could count fluctuate,TheMeanQueen01,Mon,Mar,15,1
7936,05:12:00,whatever woman always victim blame message clear women whatever need,kittenita,Mon,Mar,15,1
7937,05:11:58,usually even end one tire old man one battle scar hound dog one extremely dead,PitOfMansFears,Mon,Mar,15,1
7938,05:11:54,mobile operator internet data cut myanmar limitless hear wifi cut soon daily dead rate,aMh14783,Mon,Mar,15,1
7939,05:11:53,bago today one hindu lady shoot dead neck body dump sewage military seem sing,zen27456173,Mon,Mar,15,1
7940,05:11:51,honor iconic talkdeadtome week want miss one apple,JohnnyODell,Mon,Mar,15,1
7941,05:11:50,closest ive get yall deactivate unfollowing,shymydude,Mon,Mar,15,1
7942,05:11:50,dead kelly amp sinema rtw however speak selfish perspective discu,gregquinn,Mon,Mar,15,1
7943,05:11:48,night owls kell hyde pick might move arrows true arrows replace mitch,Spacema11738062,Mon,Mar,15,1
7944,05:13:23,happy better sorry still struggle infuriate deniers use ish,katbird74,Mon,Mar,15,1
7945,05:12:11,better without,mrth4ia,Mon,Mar,15,1
7946,05:15:09,max stossel put perspective base little information machine know better,TruthInAdvertin,Mon,Mar,15,1
7947,05:13:12,dead ass make beat years use think make beat rocket science stay,OG_Veezo,Mon,Mar,15,1
7948,05:08:48,enough make gal wonder perhaps would better kind nationwide universal,mostlymartha,Mon,Mar,15,1
7949,05:08:05,better dead,witchdoctorv,Mon,Mar,15,1
7950,05:07:43,shame still live ideology dead everyone would lot better,onedarwinian,Mon,Mar,15,1
7951,05:07:24,originally call chicago transit authority get sue chicago transit author,TransBayTammy,Mon,Mar,15,1
7952,05:08:05,tire help people even get shit together,abigail00666209,Mon,Mar,15,1
7953,05:04:27,indicative represent senate tire live rich white men rule white,girl75219,Mon,Mar,15,1
7954,05:04:08,tire live standards social media yeah people like picture actually really,halfemptyygirll,Mon,Mar,15,1
7955,05:01:32,tire live,Blithekiller,Mon,Mar,15,1
7956,03:15:09,tire see taylor swift still fan,kaaay_dawggg,Mon,Mar,15,1
7957,03:00:24,lordy tire whataboutism point counterpoint crap always follow statements like,MTruthspeaker,Mon,Mar,15,1
7958,02:55:25,please please tire waste everybody time photographer graphic designer pleas,putdatonmommas,Mon,Mar,15,1
7959,02:31:41,lot men something worst get catch,Helen32789705,Mon,Mar,15,1
7960,02:15:22,tire hurt every day,408mamii,Mon,Mar,15,1
7961,02:12:06,know get tire say thing week week sick cry live fear,RandleYvonne,Mon,Mar,15,1
7962,02:09:32,tire live cage,virginiasmirror,Mon,Mar,15,1
7963,02:04:42,tire live suicidal way know,AlanisAlvarad18,Mon,Mar,15,1
7964,02:03:45,really sick tire hurt,iineedcash28,Mon,Mar,15,1
7965,02:03:29,tire shit come fee whenever come lol big creators dont need answer anyone one,tyrennorawr,Mon,Mar,15,1
7966,02:02:45,yeah tire pay attention,Neatnique,Mon,Mar,15,1
7967,01:59:26,honestly tire tear well guess someday live big,evrmcrre,Mon,Mar,15,1
7968,01:59:03,tire live right still never see bitch,AprillJazminn,Mon,Mar,15,1
7969,01:57:26,basically say tire live historical events,Louck_Hannah,Mon,Mar,15,1
7970,01:57:13,tire live way enough come back put soul every video,ChiyxCapalot,Mon,Mar,15,1
7971,01:54:22,happen japan tire live world sexualize sexually abuse girls,banaili,Mon,Mar,15,1
7972,23:42:43,guy really need main gar tire lonely without partner want main gar,_azarathheiress,Sun,Mar,14,1
7973,23:42:07,tire live without really live die would like actually live first five feet apart,mahmoudelbaz353,Sun,Mar,14,1
7974,23:41:06,soul hurt reality sick tire live perpetual fear amp hopelessness,pothonmater,Sun,Mar,14,1
7975,23:39:37,tire live wid demons always invitin,tri47an,Sun,Mar,14,1
7976,23:38:08,tire live,englishwithdeya,Sun,Mar,14,1
7977,23:37:47,okay tire shiy move live room,lisslovebot,Sun,Mar,14,1
7978,23:37:29,anyone tire live like scrounge,OchiRobles,Sun,Mar,14,1
7979,23:23:24,life actually genius measure consistently top,patrickpoet,Sun,Mar,14,1
7980,21:46:24,since president suppose entertainer chief remember former guy administration,FundForHumanity,Sun,Mar,14,1
7981,19:27:13,two months without suicidal,alykayeee,Sun,Mar,14,1
7982,18:09:04,suicidal thoughts lead jason docton save live risk gamers,GamingBricaBrac,Sun,Mar,14,1
7983,18:05:01,suicidal thoughts lead jason docton save live risk gamers,GamesBeat,Sun,Mar,14,1
7984,16:21:12,suicidal beg help,Tknox421,Sun,Mar,14,1
7985,15:41:08,never life felt break alone defeat suicidal would absolutely end,jaredoban,Sun,Mar,14,1
7986,15:35:13,suicidal love,xpatsxjoshx,Sun,Mar,14,1
7987,14:48:41,glad leave see ppl will,Mzhy_99,Sun,Mar,14,1
7988,14:22:48,gaslighting want make feel better assert kid suffer depression learn,GlassesRustin,Sun,Mar,14,1
7989,12:23:23,alien squint report make sense humans mass suicidal fixation poison explana,williamreynolds,Sun,Mar,14,1
7990,09:42:42,ugly repulsive conduct absolutely inept civilian political aborigines prove would suicid,implanner,Sun,Mar,14,1
7991,09:23:43,youre goddamn right would want deal spooky suicidal shit,AngeloCarreon14,Sun,Mar,14,1
7992,06:16:08,alien squint report make sense humans mass suicidal fixation poison,DailyMicroFic,Sun,Mar,14,1
7993,23:44:27,teach kid ask help need beg plead silently disengagement,tinwisc,Sat,Mar,13,1
7994,23:11:14,suicidal since like years old really fun would love crumb live,hikia_lani,Sat,Mar,13,1
7995,22:24:25,suicidal thoughts lead jason docton save live risk gamers,deantak,Sat,Mar,13,1
7996,19:13:37,,WaltFrench,Sat,Mar,13,1
7997,18:53:28,wait cover suicidal tendencies different song afraid click link,1818Sfguy,Sat,Mar,13,1
7998,17:32:55,wife suicidal husband head men,MaryFernandez,Sat,Mar,13,1
7999,15:33:02,suicidal thoughts lead jason docton save live risk gamers dean takahashi venturebeat,TINTechBloggers,Sat,Mar,13,1
8000,14:54:13,swipe keyboard keep correct stoicism suicidal fair correlations paths strong also wrong,scottrcole,Sat,Mar,13,1
8001,10:29:10,freedom tell leave house lunch friends seek mental health,GalloUK13,Sat,Mar,13,1
8002,04:50:06,say embarrass sure would benefit lie suicidal,mikeijames,Sat,Mar,13,1
8003,04:24:43,gaslighting want make feel better assert kid suffer depression,JenniferSey,Sat,Mar,13,1
8004,04:05:08,data amount repetitions depress stagger want use little avai,haHeyoka,Sat,Mar,13,1
8005,01:48:47,meghan mum mental health worker doriarox yet powerless help suicidal hormonal daughter aware comm,XtenFaust,Sat,Mar,13,1
8006,01:28:46,idk serious feel suicidal hope okay rico,xkombuchaqueenx,Sat,Mar,13,1
8007,22:35:03,jam doohan discuss best thing ever life aka help suicidal startrek fan,BondageLand,Fri,Mar,12,1
8008,21:50:37,meghan markle alone suicidal ideation pregnant silent public health crisis,chibishonen,Fri,Mar,12,1
8009,20:58:31,cbs interview oprah meghan markle talk depression suicidal thoughts pregnant experts,GawlinskiLaura,Fri,Mar,12,1
8010,20:25:03,cbs interview oprah meghan markle talk depression suicidal thoughts pregnant,Healthline,Fri,Mar,12,1
8011,19:52:36,anything address terrible feel right really suggest,icedoatmatcha,Fri,Mar,12,1
8012,19:28:42,every time remember wandavision today,Suicidal_Harley,Fri,Mar,12,1
8013,18:34:29,feel psychologically women significant distress feeli,MediClit,Fri,Mar,12,1
8014,16:07:58,since tag respond take depression,AccordbizMolly,Fri,Mar,12,1
8015,12:41:29,literally suicidal last years man mental abuse manipulate gaslightin,positively_bri,Fri,Mar,12,1
8016,05:33:32,whenever read self help book people try encourage growth risk become angrily suicidal,Robert_Mason_SF,Fri,Mar,12,1
8017,03:33:13,fire san jose police officer anthony vizzusi amp michael santos find liable kill old anthonynu menta,MillerIpaul1,Fri,Mar,12,1
8018,01:31:45,meghan markle alone suicidal ideation pregnant silent public health crisis,jilevin,Fri,Mar,12,1
8019,20:08:37,sign amp share petition top thread support justiceforanthonynu visit,svdebug,Thu,Mar,11,1
8020,20:08:34,fire san jose police officer anthony vizzusi amp michael santos find liable kill old anthonynu dur,svdebug,Thu,Mar,11,1
8021,19:02:48,kid hurt suicidal school focus fix major problem,IngaWSF,Thu,Mar,11,1
8022,17:56:30,much free time comment thing,devish,Thu,Mar,11,1
8023,17:48:42,better take gun sound suicidal,pbsaurus,Thu,Mar,11,1
8024,17:44:54,try get therapist assessor basically say suicidal enough get one faster earliest appt,baddie__saddie,Thu,Mar,11,1
8025,16:34:13,suicidal hate poke prod night without rest shitty hospital food,ferallush,Thu,Mar,11,1
8026,16:16:29,lately suicidal spiders things like throw towards drain water,humofthecity,Thu,Mar,11,1
8027,16:08:09,self publish would easier avenue face suicidal ideation every time reject bad,trevorruth4,Thu,Mar,11,1
8028,16:01:11,recollections care suicidal teen devastate self inflict gunshot wind lead physician,docweighsin,Thu,Mar,11,1
8029,15:51:56,want throw depression fear dad two adult boys,jeffreyswisher,Thu,Mar,11,1
8030,15:41:28,thing get suicidal thoughts high school sport run lift,stephcard20,Thu,Mar,11,1
8031,12:44:57,update suicidal subject surrender police hour long standoff subject take custody menta,arnerich,Thu,Mar,11,1
8032,10:48:18,hateful remark give opinion outrageous call silence critics believ,Annie96070083,Thu,Mar,11,1
8033,09:32:41,mind reader,jamie_8888,Thu,Mar,11,1
8034,07:26:20,best friend tell suicidal idea people assume know others,anastasialeev4,Thu,Mar,11,1
8035,07:03:49,tact nuance key right remember lot people ask suicide scare,TMcGreenberg,Thu,Mar,11,1
8036,06:12:27,covid deaths children influenza deaths children year deaths suic,MonicaGandhi9,Thu,Mar,11,1
8037,06:08:31,see question statement usa today school open article,MonicaGandhi9,Thu,Mar,11,1
8038,05:34:39,symptoms experience bpd auditory verbal hallucinations dissociation substance alcoho,stephcard20,Thu,Mar,11,1
8039,05:24:02,ask staff mhsf shortage skilled mental health workers nationwide never responde,WryBartender,Thu,Mar,11,1
8040,04:54:59,plus get support people depress august,jenneraub,Thu,Mar,11,1
8041,03:44:26,turn professional hobby venture invest suicidal unless right,tomloverro,Thu,Mar,11,1
8042,03:21:11,update suicidal subject surrender police hour long standoff subject take custody,DanvilleINFO,Thu,Mar,11,1
8043,02:40:13,hateful remark give opinion outrageous call silence critics,MaryFernandez,Thu,Mar,11,1
8044,02:03:45,glad know people deal suicidal thoughts wher,Vance1701,Thu,Mar,11,1
8045,01:39:25,assume call sharon liar mention suicidal years ago,Marcella555,Thu,Mar,11,1
8046,01:35:05,piers believe meghan suicidal due alienation royals,232Msgta,Thu,Mar,11,1
8047,00:11:15,one reason buy one incident keep sleep months,DollyRocket6,Thu,Mar,11,1
8048,22:51:15,michael jordan say learn ryan coogler amp denzel washington anticipation creed iii ready,Suicidal_Harley,Wed,Mar,10,1
8049,22:28:37,regard piersmorgan disbelief meaghanmarkle assertions trouble claim sui,scottrh,Wed,Mar,10,1
8050,22:00:15,research read thirty day suicidal thoughts behaviors among hospital workers first wave,UCSFPsychiatry,Wed,Mar,10,1
8051,21:56:15,look think piers culpable discount suicidal thoughts,AccordbizMolly,Wed,Mar,10,1
8052,21:39:23,piers try cancel markle claim suicidal thoughts stop dude,paisanpaisan,Wed,Mar,10,1
8053,20:41:25,someone know experience suicidal thoughts call call national suicide prevention,jhsu88,Wed,Mar,10,1
8054,18:36:32,assumption would correct suicidal munch crunch wrap,Journey_Giu,Wed,Mar,10,1
8055,18:00:29,royals even like piers amp know sit amp call woman sui,KwanLi18,Wed,Mar,10,1
8056,17:21:53,say lie suicidal thoughts damage remark never like smarmy opportunist jerk,samvanzandt,Wed,Mar,10,1
8057,15:40:56,ask staff mhsf shortage skilled mental health workers nationwide neve,sf_kerry,Wed,Mar,10,1
8058,15:27:27,wonder conversation would oprah interview robin,reedmiller,Wed,Mar,10,1
8059,10:10:28,say meghan lie suicidal,justkelly_ok,Wed,Mar,10,1
8060,05:18:12,mar suicide bombers attack justice foreign ministries communications institute central baghdad https,JoelWing2,Mon,Mar,15,1
8061,02:39:37,cry bts wait moment whole life might end life rig,ninersdude420,Mon,Mar,15,1
8062,15:46:35,end passion someone know achievement always quie,jostraveler,Sun,Mar,14,1
8063,15:36:18,ngl really excite reach ego death always read wonder suppos,stephcard20,Sun,Mar,14,1
8064,12:05:35,stand god end life would hope would single bite talent leave could,nubiaredondo,Sun,Mar,14,1
8065,02:40:17,also extra tough know vaccinate friends get together watch time bandi,sherrying,Sun,Mar,14,1
8066,23:50:45,biggest revenue day company lose covid shutdown thanksgiving ruin lose,ohbourgeoisgirl,Sat,Mar,13,1
8067,21:53:44,get confirmation text dose tomorrow feel unreal yet real wait nightmare,JeremyR1992,Sat,Mar,13,1
8068,16:07:06,year ago today partner long distance come home plan visit never leave kitten still consta,civildiscourse7,Sat,Mar,13,1
8069,15:04:14,others may see human see angel nigeria end poverty sir hope last,Winning_sure2,Sat,Mar,13,1
8070,14:57:36,others may see human see angel nigeria end poverty sir hope last,Abdulla78249202,Sat,Mar,13,1
8071,14:57:19,others may see human see angel nigeria end poverty sir hope last,Abdulla78249202,Sat,Mar,13,1
8072,11:07:16,like toddlers want end playdates rat start grab whatever part reach hold,lvpaxx,Sat,Mar,13,1
8073,06:38:26,keep think end game live enough let family thrive want happiness,xrossfader,Sat,Mar,13,1
8074,05:37:18,year ago today partner long distance come home plan visit never leave kitten still,audiosand,Sat,Mar,13,1
8075,01:41:33,one day people push end wits nobody ever shit say nothing lef,ifhybitchxo,Sat,Mar,13,1
8076,01:14:42,dream life get grant pay take article tur,dgt211,Sat,Mar,13,1
8077,22:33:53,like toddlers want end playdates rat start grab whatever part reach,jeeyonshim,Fri,Mar,12,1
8078,21:40:04,stand god end life would hope would single bite talent leave,sandy_carter,Fri,Mar,12,1
8079,18:46:28,question husband discuss end life preferences due covid rec,SDEubank,Fri,Mar,12,1
8080,18:00:38,shrug along end world night life,likeholywine,Fri,Mar,12,1
8081,17:07:02,end especially haunt daughter play game since son high school life,JohnBranchNYT,Fri,Mar,12,1
8082,17:00:41,years ago today show morning friend john ehrman wed witness ketubah little kno,GeorgeFuller14,Fri,Mar,12,1
8083,16:59:34,years ago today show morning friend john ehrman wed witness ketubah little,Donald_E_Heller,Fri,Mar,12,1
8084,06:39:56,amount money flow silicon valley stagger right case point announce bigge,jpcabaniss,Fri,Mar,12,1
8085,05:17:06,new song end life prod soundcloud spotify,martinn_jr2,Fri,Mar,12,1
8086,05:01:36,old near end life already crazy meds want try,mental_arts,Fri,Mar,12,1
8087,02:44:00,,kamioshie,Fri,Mar,12,1
8088,02:13:50,new song end life prod soundcloud spotify,kamioshie,Fri,Mar,12,1
8089,18:36:04,entire life gon network graphic end day,citrusgirlpaige,Thu,Mar,11,1
8090,17:54:16,join twitter end december ruin life,hackcartoonist,Thu,Mar,11,1
8091,17:41:46,regardless end life mourn naacp work fight support civi,tomcoates,Thu,Mar,11,1
8092,07:21:42,years ago almost day plan end life find way rabbit hole fal,MagickBoi,Thu,Mar,11,1
8093,04:45:49,actually mom last anyway feel like lot ppl,feral_ghost,Thu,Mar,11,1
8094,00:05:39,year old son die december since stimulus year tax base qualify stimulus,nikola1tesla,Thu,Mar,11,1
8095,23:02:44,recall wake less tire sensitive caffeine half life caffeine,athuras,Wed,Mar,10,1
8096,22:12:35,existence love definitely get offend whenever someone react tryna invade life,sexiiireed,Wed,Mar,10,1
8097,21:59:10,challenge end day life probably best alb,Marc_Fagel,Wed,Mar,10,1
8098,20:45:04,existence love definitely get offend whenever someone react tryna invade life,sapphiresucker,Wed,Mar,10,1
8099,18:48:18,correct sad guess decide take years end life,anniefryman,Wed,Mar,10,1
8100,18:34:18,okay finally wfh desk nearly ideal configuration assume mean wfh life come,WishUponAShar,Wed,Mar,10,1
8101,17:55:17,amount money flow silicon valley stagger right case point announce,dougludlow,Wed,Mar,10,1
8102,17:41:30,end life,ellistimothy46,Wed,Mar,10,1
8103,03:10:20,ever get book award humble four decades poverty work dead end job,ericlinuskaplan,Wed,Mar,10,1
8104,02:15:19,ever get book award humble four decades poverty work dead end job,hackcartoonist,Wed,Mar,10,1
8105,01:55:46,life divine time accept path even see light end tunnel,sensualxsirena,Wed,Mar,10,1
8106,08:13:28,lot things mind lately stressful months far want end change life,spartankingv,Tue,Mar,9,1
8107,07:19:49,manage entire life without end sopranos spoil tonight finish last,jmarcello123,Tue,Mar,9,1
8108,06:57:15,ever heal honestly dislike helpless feel want normal healthy life hope eventually,MIRILMN,Tue,Mar,9,1
8109,05:03:32,things easily derail whatever happen fall back ones love ones pick bac,thealexchu1,Tue,Mar,9,1
8110,04:53:17,forget everything terrify never energy back,brielle,Tue,Mar,9,1
8111,21:04:29,grad students ask anything seminars establish scientific leaders think important,christineyyeh,Mon,Mar,8,1
8112,20:04:24,move end amp become active twitter time like antic,JuniperDolor,Mon,Mar,8,1
8113,17:26:59,old boss use say tell many good things life every two good thin,jkiyomi,Mon,Mar,8,1
8114,08:26:00,express gratitude things life put state able receive,Trikzy4D,Mon,Mar,8,1
8115,03:17:14,end life svnam kami oshie produce recyclebin come friday march,martinn_jr2,Mon,Mar,8,1
8116,03:09:05,end life svnam kami oshie produce recyclebin come friday march,kamioshie,Mon,Mar,8,1
8117,01:57:05,voiceover real life panel exactly need end day star group discuss thank,cissyspeaks,Mon,Mar,8,1
8118,01:47:48,voiceover real life panel exactly need end day star group discuss,BoyceGames,Mon,Mar,8,1
8119,00:11:11,literally know find fox news cable line never watch commercials life,IVLoveForever,Mon,Mar,8,1
8120,20:57:59,nothing ruminate end life happen aight gucci,pinnateleif,Sun,Mar,7,1
8121,19:27:27,,YourselfSnowman,Sun,Mar,7,1
8122,19:09:16,ever know strength coach performance trainer terrible job life,Xthesportzgeek,Sun,Mar,7,1
8123,17:08:14,idk whether feel horrify scene vindicate risk life leave idaho,maskmyhood,Sun,Mar,7,1
8124,05:05:38,thank courage show vulnerability world amp never let,ecomuse,Mon,Mar,15,1
8125,00:41:20,dream marcus baker love never want wake,lianneviktor1a,Mon,Mar,15,1
8126,23:39:58,fear monger facts prioritize violent criminals victims,jojo37650305,Sun,Mar,14,1
