,created_at,tweet,user_name,weekday,month,day,at_risk
0,01:22:21,harry fanhou,shawuanlover,Mon,Mar,15,1
1,01:22:21,yeahhh harryy bloody legend youuu,NEWANGEL93,Mon,Mar,15,1
2,01:22:21,pati members newsletter send inbox please check forextrading forextrader,uk2asia,Mon,Mar,15,1
3,01:22:21,point amp dim birthday dubnation,aldrinkidd_,Mon,Mar,15,1
4,01:22:20,know need hear bipartisanship pay bill put food table,jhin58794874,Mon,Mar,15,1
5,01:22:20,twitter ban type tweet city tennessee call ahhahahah phi,nocturnely,Mon,Mar,15,1
6,01:22:20,stop play harry,pollyswrld,Mon,Mar,15,1
7,01:22:20,hello trust wallet help desk send direct message explain,thetrusthelp_,Mon,Mar,15,1
8,01:22:19,lookin leave cuz treat right,wolfhoundgod,Mon,Mar,15,1
9,01:22:19,also say central park kid undeniably engage suicidal ritual dangerous masculinity another tex,You_Love_Ernest,Mon,Mar,15,1
10,01:22:19,poster leave think highlight fact create semi robust welfare state overnight,PlebeIanMac,Mon,Mar,15,1
11,01:22:19,change net worth march march musk bezos page brin zuck ellison,JSaint226,Mon,Mar,15,1
12,01:22:19,lad day move average move day move average november view odds oth,Tickeron,Mon,Mar,15,1
13,01:22:19,wait racist know,wokelifeworld,Mon,Mar,15,1
14,01:22:19,grammys,DisneylandDyl,Mon,Mar,15,1
15,01:22:19,fit lead hope wherever work put bed similarly time come daily news reporter storm gif,MattRosoff,Mon,Mar,15,1
16,01:22:18,point last season raiders brown worst franchise mean raide,michael60847712,Mon,Mar,15,1
17,01:22:18,thank god,supkalish,Mon,Mar,15,1
18,01:22:18,selection sunday winners losers pac belong first column day ideal win,TheBMartin,Mon,Mar,15,1
19,01:22:18,helloo cause wtf,Perfectlyebonix,Mon,Mar,15,1
20,01:22:18,actually nothing like vaccines work cells know difference mrna,BunneeShelton,Mon,Mar,15,1
21,01:22:17,double play squad,SAProfileCard,Mon,Mar,15,1
22,01:22:17,postgame content timeline need,ItsLilLizzy,Mon,Mar,15,1
23,01:22:16,many boas appear zoom call tomorrow grammys,MsCodyGodwin,Mon,Mar,15,1
24,01:22:16,two kinds interest active receptive harness power skyrocket love life learn,susan_e_winter,Mon,Mar,15,1
25,01:22:16,way celebrate birthday,setethecreator,Mon,Mar,15,1
26,01:22:16,one time check simply enough pay bill one year pandemic many americans liv,imthedronelord,Mon,Mar,15,1
27,01:22:16,compare number unique owners two difference close,securethedub,Mon,Mar,15,1
28,01:22:15,quit grammy watch idea artists hear songs old imok,kerikukral,Mon,Mar,15,1
29,01:22:15,harry style fuck yeahhh grammys,TheArtofBella,Mon,Mar,15,1
30,01:22:15,,theactivestick,Mon,Mar,15,1
31,01:22:15,san francisco join three bay area counties alameda contra costa santa clara expand vaccination distri,wcrmares,Mon,Mar,15,1
32,01:22:14,itsbillions tax system expose amp unfair long term billions suck away minorities amp likely happen,BlackResearch_,Mon,Mar,15,1
33,01:22:14,good,Vektar2,Mon,Mar,15,1
34,01:22:14,know come,dwaltchack,Mon,Mar,15,1
35,01:22:14,rut almost double since november let one sink bubble russell,BlockchainTrad,Mon,Mar,15,1
36,01:22:14,delete story,_oscarmartinez7,Mon,Mar,15,1
37,01:22:13,argue money education disadvantage kid arguin,MariaGlymour,Mon,Mar,15,1
38,01:22:13,send noods,ajelazw0rld,Mon,Mar,15,1
39,01:22:13,god bless klay thompson,ivan_gozum10,Mon,Mar,15,1
40,01:22:13,everyone birria tacos mole birria tacos gas,ahmahgodIMIG,Mon,Mar,15,1
41,01:22:12,bidenomics exactly reverse republican trickle economics rather cut tax top hope,PWalker39557861,Mon,Mar,15,1
42,01:22:12,light setthenightalightbts,aroyooniverse,Mon,Mar,15,1
43,01:22:12,harry style,wontyoustayAM,Mon,Mar,15,1
44,01:22:23,wait kristy post pic know face lmao,bridgetbaseball,Mon,Mar,15,1
45,01:22:23,lad day move average move day move average november view odds indicat,MichalFutera,Mon,Mar,15,1
46,01:22:22,phone call andrew andrew drink today,hotbrewdrew,Mon,Mar,15,1
47,01:22:22,easy wed updos summer weddingtips weddingideas gettingmarried weddingplanning,HameedaKe,Mon,Mar,15,1
48,01:22:22,hero academia deku face grim question may decide fate world read free official,N0TAWEIRD0,Mon,Mar,15,1
49,01:22:22,capt jennifer moreno army nurse corps kill ranger lead special operations night mission,mgb4321,Mon,Mar,15,1
50,01:22:22,take look make today popcorn birthday cake,ivan_gozum10,Mon,Mar,15,1
51,01:22:22,,greenwhite600,Mon,Mar,15,1
52,01:22:20,try attempt suicide,KretanBassMusic,Mon,Mar,15,1
53,01:22:20,commit suicide still better half people community,gabbbiiiiiii1,Mon,Mar,15,1
54,01:22:19,see name remind legacy teddey people kill cop murder cop commit suicid,davenjm1,Mon,Mar,15,1
55,01:22:18,suicide prevention month sure hope,ghoulguys,Mon,Mar,15,1
56,01:22:18,yummy win suicide pact,hynjnpopper,Mon,Mar,15,1
57,01:22:10,know good feel bitch nearly make kill back middle school,pechatonslut,Mon,Mar,15,1
58,01:21:58,definitely kill anyone think wear mask dip,Tico413,Mon,Mar,15,1
59,01:21:37,nah get kill,Brandonhkujo,Mon,Mar,15,1
60,01:21:08,justin bieber win kill,emmuuhly,Mon,Mar,15,1
61,01:21:05,kill,OldJayFake,Mon,Mar,15,1
62,01:20:52,cap alone homeless try kill work dish boy radio,CunnilingusD,Mon,Mar,15,1
63,01:20:51,ill kill,CowsaysMOO0,Mon,Mar,15,1
64,01:20:45,yummy kill,beyoncetimee,Mon,Mar,15,1
65,01:20:42,simply kill,DEANSFlLM,Mon,Mar,15,1
66,01:20:17,someone play bad indian cover songs office speaker want kill badly want die end please,_maousami_,Mon,Mar,15,1
67,01:19:24,say performance make want kill,JamesKyleLamb,Mon,Mar,15,1
68,01:19:22,suicide amount time ive see word kill kill really nice almo,collymmit,Mon,Mar,15,1
69,01:19:18,gon fuck kill,kayhardcastIe,Mon,Mar,15,1
70,01:19:09,big vibes love college graduations ruin great recessions early deci,beccahoma,Mon,Mar,15,1
71,01:18:49,guess kill wtf,AannabeanA,Mon,Mar,15,1
72,01:18:36,still need play game sometime bad first play exclusively play,SmolButrflyGorl,Mon,Mar,15,1
73,01:18:23,gon fuck kill,cailinoharaa,Mon,Mar,15,1
74,01:18:15,new day type thing love workout herewego modify windmill kill,CelticKim1,Mon,Mar,15,1
75,01:18:07,past weeks bullshit death threats suggestions kill realize things,IPossibillities,Mon,Mar,15,1
76,01:17:46,new header yeah want kill performance losinf sanity,taylorfication,Mon,Mar,15,1
77,01:17:35,ure funny thank kill hit,jujuwhore,Mon,Mar,15,1
78,01:17:29,deerie hour anything happen would kill everyone room,gorowhoro,Mon,Mar,15,1
79,01:17:21,take note artists embarrass gen rise kill rest http,Regina_Vainilla,Mon,Mar,15,1
80,01:17:17,suicide kill,heart4lino,Mon,Mar,15,1
81,01:17:05,money prepare kill help hospital bill son starve wallet zkj obs,apoorlife2,Mon,Mar,15,1
82,01:16:42,could imagine talk problems instead anything else idk guy bore,analsexmaster69,Mon,Mar,15,1
83,01:16:23,die kill,steptastical,Mon,Mar,15,1
84,01:16:23,would kill ever post girl,5aMMintoronto,Mon,Mar,15,1
85,01:16:04,antis tell kill feel lot like get threats hurl toddlers,zevan_silver,Mon,Mar,15,1
86,01:15:56,bye cancel cause like wendys lie like years,makaylaaTrash,Mon,Mar,15,1
87,01:15:31,ion know ppl like kill see future hold first bitch future want,drip0r_drown,Mon,Mar,15,1
88,01:15:29,try tell keep calm apink mention prepare stuff anniversary,fullwithrong,Mon,Mar,15,1
89,01:15:28,people really care last week post kill nobody even say damn,asalahtime,Mon,Mar,15,1
90,01:15:21,bieber win best pop solo performance gon kill notjoking,elizabethkmua,Mon,Mar,15,1
91,01:15:06,every single time hear song wan kill,A23dlkzlk2ezx,Mon,Mar,15,1
92,01:15:03,okay thank bro definitely dont want kill,Darkness6112,Mon,Mar,15,1
93,01:14:51,kill mother,greygray_,Mon,Mar,15,1
94,01:13:58,die kill,AzureBlue_Moon,Mon,Mar,15,1
95,01:13:54,grammys kill,coolerthanurm,Mon,Mar,15,1
96,01:13:33,break nail break last time grow back break kill,snailluvr4000,Mon,Mar,15,1
97,01:13:21,nah kill eno alright,aaloya_w,Mon,Mar,15,1
98,01:13:19,wan kill,THEBIGQBKJL,Mon,Mar,15,1
99,01:13:15,wan kill,NAbdelmajeid,Mon,Mar,15,1
100,01:04:19,abuse pedophilia suicide ableism slur mention rape drug knife sexual harassment,F4IRY5IX,Mon,Mar,15,1
101,01:02:11,think suicide suicidal note save life comprehend write bipolarclub mentalhealthma,BipolarClubDx,Mon,Mar,15,1
102,00:26:38,suicide note sit drawer taunt haunt lay soul bare drawer,BipolarClubDx,Mon,Mar,15,1
103,22:31:49,fire fair enough defense entirely clear anti suicide hotline,emojisus,Sun,Mar,14,1
104,22:14:26,anything tier add suicide note,_sector51,Sun,Mar,14,1
105,21:43:08,hate people use love gay son song heathers musical cute funny animatics,goatvaxing,Sun,Mar,14,1
106,21:30:48,draw opinions like bourdain either actually celebrate death,SamHassas,Sun,Mar,14,1
107,21:22:06,day aaron rodgers retire day tweet suicide note,ClutchRodgerss,Sun,Mar,14,1
108,21:14:38,draft suicide note,thxtsadapollo,Sun,Mar,14,1
109,21:04:19,write suicide note,sajoubiter,Sun,Mar,14,1
110,20:59:07,gon suicide note,_purpleish,Sun,Mar,14,1
111,20:55:36,gon suicide note,yoongifraud,Sun,Mar,14,1
112,20:34:44,clip gon attach top suicide note,Stxcie_,Sun,Mar,14,1
113,20:33:43,child abuse suicide favorites,dark_entrees,Sun,Mar,14,1
114,20:27:55,think suicide suicidal note save life comprehend write bipolarclub mentalhealthmatters,NawazSnafridi,Sun,Mar,14,1
115,19:25:19,note say top work set fella favourite suicide track keep back,SharmanSomerset,Sun,Mar,14,1
116,19:07:23,suicide personal suicide note discord server make appearance least death organise yall,fromisap,Sun,Mar,14,1
117,19:04:56,suicide note,grantster_123,Sun,Mar,14,1
118,18:48:25,please note amp biggest cking criminals ever meet life gaf,military_crime,Sun,Mar,14,1
119,18:25:28,suicide note tottenham hotspurs fault,senyor_eldracco,Sun,Mar,14,1
120,18:07:25,laugh basically get cheat joke totally put suicide note,esexIover,Sun,Mar,14,1
121,17:24:45,today another farmer rajveer singh age years commit suicide suicide note write request,Badsah77813160,Sun,Mar,14,1
122,17:11:30,suicide note sit drawer taunt haunt lay soul bare drawer,vivianewrenn,Sun,Mar,14,1
123,16:30:09,remind incident one best friend post suicide note facebook jump move train,TheObnoxKoshur,Sun,Mar,14,1
124,15:57:24,remind incident one best friend post suicide note facebook jump movin,Junnyslife,Sun,Mar,14,1
125,15:45:28,would prefer suicide note work,satsdart,Sun,Mar,14,1
126,15:44:52,suicide mention use suicide note draft,jjongluvz,Sun,Mar,14,1
127,15:43:00,would prefer suicide note work,MapleReborn,Sun,Mar,14,1
128,15:32:14,suicide note,nickcIark_,Sun,Mar,14,1
129,14:55:41,ever die parent gon see formal suicide note image trollface give,Chrotoni,Sun,Mar,14,1
130,14:49:05,george eastman inventor founder eastman kodak commit suicide march single gunshot throug,EdPearce3,Sun,Mar,14,1
131,14:44:37,please note akechi goro icon one favorite fictional character ever also narcissistic,BEG_BioEngGolem,Sun,Mar,14,1
132,14:42:30,make sure write name suicide note want special mention,cuItbunny,Sun,Mar,14,1
133,14:28:00,day kodak founder george eastman commit suicide severe pain spinal disord,GuyHutchinson,Sun,Mar,14,1
134,14:26:04,print leave suicide note,choerryrookie,Sun,Mar,14,1
135,12:28:29,print leave suicide note,patheticggirl43,Sun,Mar,14,1
136,12:10:21,please note akechi goro icon one favorite fictional character ever also narcissistic,koshitantankohi,Sun,Mar,14,1
137,10:56:09,speed lag gon personally mention suicide note,shahiedcariemx,Sun,Mar,14,1
138,01:02:06,want vent feel twitter wont allow write long texts write lette,RexiaAn,Mon,Mar,15,1
139,22:36:41,memory spark letter tragic suicide parent want publicise,Critique1788,Sun,Mar,14,1
140,20:07:39,write letter someone care decide make life hell write almost commit,essyfawn,Sun,Mar,14,1
141,11:36:21,sir situation worsen much family live tremendous pressure request grant,Adnanadam18,Sun,Mar,14,1
142,10:41:25,sir situation worsen much family live tremendous pressure request,MaktoobMedia,Sun,Mar,14,1
143,01:55:53,yesterday year old daughter receive unsolicited personally address letter home,WaltersPRnz,Sun,Mar,14,1
144,01:29:47,last non queue post tumblr suicide letter clearly state bio blog inactive,featherydick,Sun,Mar,14,1
145,21:51:54,favorite translation say hide barb aim hideyoshi lord tormentor order,thetealetter,Sat,Mar,13,1
146,18:50:46,buy shirt guitar center suicide letter end neon ernie bal,pmclellan,Sat,Mar,13,1
147,18:50:36,use women make men suicide bombers country,TuggJuan,Sat,Mar,13,1
148,12:20:25,maybe write suicide letter today,zayn696699,Sat,Mar,13,1
149,09:42:53,celebrity crush get marry imma commit double murder suicide real stay safe,Nutellasyomama,Sat,Mar,13,1
150,08:41:15,popular app dupe friend one million naira live tweet act nothing wrong,Letter_to_Jack,Sat,Mar,13,1
151,06:24:45,literally manuscript read critique professional editor literally thing read,KatWritrix,Sat,Mar,13,1
152,05:30:22,hit feel,1nn0c3nty0uth,Sat,Mar,13,1
153,01:45:25,remember write suicide letter mom find next time bury,ImperfectKai,Sat,Mar,13,1
154,00:55:43,amen sisters commit suicide best friend commit suicide part life awakenin,JessanDunnOtis,Sat,Mar,13,1
155,22:01:02,amen sisters commit suicide best friend commit suicide part life awa,MarjiJSherman,Fri,Mar,12,1
156,20:43:33,suicide attempt swim bring back life,WNBASFChapter,Fri,Mar,12,1
157,20:18:36,make old age want alive funural like come america amp grace amp frankie,Jo_Rogue,Fri,Mar,12,1
158,19:03:19,mind pete set failure political disaster run,umeshgeeta,Fri,Mar,12,1
159,17:17:43,house commons pass law enable suicide disable people yesterday dad send letter mornin,live_the_light,Fri,Mar,12,1
160,16:26:55,house commons pass law enable suicide disable people yesterday dad send letter,SpringHawes,Fri,Mar,12,1
161,16:09:27,,Sonofbharatmaa1,Fri,Mar,12,1
162,09:31:21,regard min seol forge suicide letter easy make excuse,Misscrispybread,Fri,Mar,12,1
163,07:44:35,nigeria landlord help suicide thoughts try take life nigeria landlor,BabatundeMabs,Fri,Mar,12,1
164,07:23:40,bear two drug addict alcoholics spend childhood wonder would wake,xoPinup,Fri,Mar,12,1
165,06:18:15,suicide find letter never send best friend kill next day stop sob,flowerysadness,Fri,Mar,12,1
166,06:12:55,anyway imma say something hella depress every year write letter husband base daughter age,id0rkable,Fri,Mar,12,1
167,05:36:08,think crypto end win lot reason least far world shape potential det,generativist,Fri,Mar,12,1
168,03:45:56,make appointment disappointment find set expectations really low,SimianRex,Fri,Mar,12,1
169,03:03:50,use person suicide letter live today sons post picture body say lockdown,ladylestrange,Fri,Mar,12,1
170,02:08:19,write name suicide letter,narfornothing,Fri,Mar,12,1
171,01:32:25,suicide letter face skin dry crusty,Bpdcrys,Fri,Mar,12,1
172,01:19:48,yesterday find suicide letter make sad depress rip letter,niallsgatorade,Fri,Mar,12,1
173,00:58:44,make cry long sad suicidal antidepressants find bipolar write amp hide,bpdbitch1017,Fri,Mar,12,1
174,00:45:24,mention suicide brazilian least political situation get much worse son fuck,certainrandom,Fri,Mar,12,1
175,21:57:14,course govt facilitate suicide think daft,ShireenJ,Thu,Mar,11,1
176,21:07:12,letter parent survive child suicide friendship bench forget lot brain fog,Astarte_31OCT,Thu,Mar,11,1
177,20:29:18,letter parent survive child suicide friendship bench forget lot brain,olfashdeb,Thu,Mar,11,1
178,17:08:14,amen sisters commit suicide best friend commit suicide part life awa,MarjiJSherman,Thu,Mar,11,1
179,16:18:28,never get fact nephew suicide attempt august day celebrate moms,Anadimpuhhls,Thu,Mar,11,1
180,15:52:51,google read email years ago post sidebar ads divorce lawyers suicide prevention sport,ii1111,Thu,Mar,11,1
181,09:58:33,abi question need money could make think commit suicid,Samholy5,Thu,Mar,11,1
182,06:52:36,suicide never option dear always alone think trauma othe,TMbhardy,Thu,Mar,11,1
183,01:22:26,yes unexpected suppose game really good job show price,PainlessSuffrng,Mon,Mar,15,1
184,01:22:11,admiration support thank beacon hope end violence attack tigray,BevanDufty,Mon,Mar,15,1
185,01:20:38,think end life scatter piece,A89775923,Mon,Mar,15,1
186,01:20:36,soldier heart land fight life amp freedom walk upon sand soldier father amp fri,Krishna08379919,Mon,Mar,15,1
187,01:20:08,real life want everything end life,KilluhKigh,Mon,Mar,15,1
188,01:20:08,artist read entire thread confuse hell never hear repringling life,Jelliedbrain,Mon,Mar,15,1
189,01:20:06,need make utility ladder slide end never risk life climb backwards ever,deannaortiz_,Mon,Mar,15,1
190,01:19:41,two lessons learn dad never get fight avoid,WarriorDanYT,Mon,Mar,15,1
191,01:19:26,love universe boys matter happen today love still proud,sasyashei,Mon,Mar,15,1
192,01:19:23,know rather end life feel right,SonicGokuJiren,Mon,Mar,15,1
193,01:19:06,lmao fuck think life come end,jaaysodelicious,Mon,Mar,15,1
194,01:18:54,life feel empty lonely without meredith try replace turn irreplac,moondaancer,Mon,Mar,15,1
195,01:18:42,chance years ago buchanan want end take impact quality,rickynjulian35,Mon,Mar,15,1
196,01:18:27,listen album weeks end drive city crack dawn see ivf pregnancy,mydogwontbite,Mon,Mar,15,1
197,01:18:22,would end life child turn like,MlESZK0,Mon,Mar,15,1
198,01:17:50,please end life,gayisIouis,Mon,Mar,15,1
199,01:17:15,hear salt air audibly gasp beautiful end never satisfi,sararose__,Mon,Mar,15,1
200,01:16:41,gon fuck end life,lmlyjungkook,Mon,Mar,15,1
201,01:16:37,ill end life,stfuhyungwon,Mon,Mar,15,1
202,01:15:53,cry bts wait moment whole life might end life rig,Papasmurfpizza1,Mon,Mar,15,1
203,01:15:35,omg end life please,MoonstarRyan,Mon,Mar,15,1
204,01:15:04,want end life,Deborah17435293,Mon,Mar,15,1
205,01:14:58,end life please,MoonstarRyan,Mon,Mar,15,1
206,01:14:16,person dream fail dream idk smtg admire like work hard,Blamy9,Mon,Mar,15,1
207,01:14:16,see men life family friends struggle emotionally aware end use something,mixedjade_,Mon,Mar,15,1
208,01:14:16,taylor swift performance come end worst experience life simply want minutes,amdeeeeeee,Mon,Mar,15,1
209,01:14:15,couple dont get fuck feed end life,LoserISDylan,Mon,Mar,15,1
210,01:14:07,taylor swift performance come end worst experience life simply want minutes grammys,nictothemarie,Mon,Mar,15,1
211,01:13:57,drive empty park lot scream let frustrations homeless person walk,TheBishop1385,Mon,Mar,15,1
212,01:13:45,well make good run lot laugh tear overall great life,SpeakTruthAlwyz,Mon,Mar,15,1
213,01:13:02,end army always love life thank seven,Mauita_71739,Mon,Mar,15,1
214,01:13:02,rage stream dynamite end life,bultaoreunjay,Mon,Mar,15,1
215,01:12:49,think strongly feel bind misjudge misunderstand til end life,imventilation,Mon,Mar,15,1
216,01:12:13,always say drink end ruin fuck life,__annarchy__,Mon,Mar,15,1
217,01:12:10,end never witness something disturb life time one thing silent another,TigrayAdeJeganu,Mon,Mar,15,1
218,01:11:52,happy birthday year full challenge good memories sorrow much self heal growth towards,FrankieDooSpace,Mon,Mar,15,1
219,01:11:45,seungkwan face end add five years life,juststaaaan,Mon,Mar,15,1
220,01:11:18,idk ever end anitwit far concern life ridiculously average,nickop825,Mon,Mar,15,1
221,01:11:16,really love way daehwi speak topics talk sound like really close friend give advice,Daehwi66278100,Mon,Mar,15,1
222,01:11:05,goig end life,swiftiesoldier,Mon,Mar,15,1
223,01:11:04,get baptize morning change life end dead jail,Mi_Amorr_,Mon,Mar,15,1
224,01:10:48,way smile camera end life,micaciceri,Mon,Mar,15,1
225,01:10:37,way smile camera end life,bethcrmon,Mon,Mar,15,1
226,01:10:35,life end lol shit life start get fun make yet whatever,balloonpup,Mon,Mar,15,1
227,01:09:11,one best days life want end,Kathalyn1,Mon,Mar,15,1
228,01:22:28,men never plan shit get tire ask amp suggest wake day plan already surp,shesojae_,Mon,Mar,15,1
229,01:21:58,hard wake nightmare never fell asleep,strellinhaw,Mon,Mar,15,1
230,01:21:42,wake able work country turn electricity hours happen,D_eeni_,Mon,Mar,15,1
231,01:21:41,amp grammys performance dream never want wake,desireedenise32,Mon,Mar,15,1
232,01:21:39,always like get motivation sort life time sleep wake like,minterjzlplayz,Mon,Mar,15,1
233,01:20:13,note self never draw art end think good wake literal shit,smolstick,Mon,Mar,15,1
234,01:18:56,,babybondgirl,Mon,Mar,15,1
235,01:17:57,wake choose toxic never understand,bee_aboutit,Mon,Mar,15,1
236,01:17:10,first time remember beat image back wall fist raise,kimasabe,Mon,Mar,15,1
237,01:16:03,,terrinakamura,Mon,Mar,15,1
238,01:15:02,okay bed bye pray wake harry grammy still king never change,ghostinhs,Mon,Mar,15,1
239,01:14:57,recur dream mine favourite artist post new artwork fully aware dream decide save,v_phane,Mon,Mar,15,1
240,01:14:28,remind never wake,JosyLives,Mon,Mar,15,1
241,01:12:15,grammys performance dream never want wake,bigbangfuckyou,Mon,Mar,15,1
242,01:11:49,kindly sleep never wake,quietmxtions,Mon,Mar,15,1
243,01:22:30,feel someone kiss face open eye see jordan turn face kiss,SighaThreads,Mon,Mar,15,1
244,01:22:30,end day matter many vacation sleep whatever,Manda_Brookee,Mon,Mar,15,1
245,01:22:09,make sure lose sight whatsoever main focus try capture least,VxlpineMerc,Mon,Mar,15,1
246,01:21:59,art share introduce show art tag friends drop amp comment artists work,yum_meme_swim,Mon,Mar,15,1
247,01:21:56,fauci recap need mask must wear mask pandemic last months pandemic could,RealTanMan1980,Mon,Mar,15,1
248,01:21:49,saw fox nancy say border shit trump fault believe let,ElaineMarco12,Mon,Mar,15,1
249,01:21:43,people get fomo bar one night miss hang friends get fomo,sarahhh0902,Mon,Mar,15,1
250,01:21:41,world rot make rot deserve die someone even mea,lightfobic,Mon,Mar,15,1
251,01:21:37,taylor put athlete back,prvnxcesa,Mon,Mar,15,1
252,01:21:34,annoy reality series genocidal attack ethnic amharas grief tend habitually stay,Aman02696504,Mon,Mar,15,1
253,01:21:22,wait monthsssssss finally come absolute worst experience coul,hey_jaytee,Mon,Mar,15,1
254,01:20:50,absolute machine put high quality work anyone know everything write,dynodp1,Mon,Mar,15,1
255,01:19:10,job education type civil liberties make life worth live also,enhazed,Mon,Mar,15,1
256,01:17:36,worth live lie matter cost,INFJLOVE,Mon,Mar,15,1
257,01:17:18,black women live luxury make sure performative clout appreciate assets,eternallyguided,Mon,Mar,15,1
258,01:14:47,brain melt dont wan try anymore life suck worth live thru stupid shit,cloudiwal,Mon,Mar,15,1
259,01:14:24,absolute machine put high quality work anyone know everything wri,SantiagoAuFund,Mon,Mar,15,1
260,01:07:37,single clip might worth hassle get register one clip sit,Curiousx10,Mon,Mar,15,1
261,01:01:56,page street westbound divisadero worth eastbound absolutely,DavidGallagher,Mon,Mar,15,1
262,00:54:32,cup coffee blas return quotidian good enough however one embrace,insan_felsefesi,Mon,Mar,15,1
263,00:50:05,chives great herbs since sometimes want bite worth buy thing store,ingerhogstrom,Mon,Mar,15,1
264,00:48:56,friends make life worth live cuz wouldnt,kimpatte101,Mon,Mar,15,1
265,00:48:26,dear would solve problem net worth increas,bennetthall,Mon,Mar,15,1
266,00:44:47,friends make life worth live cuz wouldnt,emmyrigasxo,Mon,Mar,15,1
267,00:34:49,afraid life believe life worth live belief help create fact william jam,BajekAlex,Mon,Mar,15,1
268,00:33:13,afraid life believe life worth live belief help create fact william jam quote,positiveKristen,Mon,Mar,15,1
269,00:32:34,good make believe make proof pudding kind guy,SeanAndrewMcGa1,Mon,Mar,15,1
270,00:31:52,yup hilarious whenever admire new zealand australia amp nations control virus public heal,TalktoBeverley,Mon,Mar,15,1
271,00:25:10,worth build anything external ever,RyanneMDMBA,Mon,Mar,15,1
272,00:18:17,spiritually adopt innocent unborn baby next months spar death culture abortions,philly92435,Mon,Mar,15,1
273,00:14:05,eren freedom whoever stand strip freedom freedom people kill,SAUD_YEAGER,Mon,Mar,15,1
274,00:07:05,counsel session therapist feel depress think worth live house association know,desimassageboy,Mon,Mar,15,1
275,00:04:35,one scroll twitter fee already determine worth,Daveydeg,Mon,Mar,15,1
276,00:03:25,backwards different priorities priorities normall,SBarutta,Mon,Mar,15,1
277,00:01:18,true self true self disgust true whatever self choos,bradjamison,Mon,Mar,15,1
278,23:59:24,life moments remember amp hold good ones let learn amp move bad,OG_Gamer1,Sun,Mar,14,1
279,23:58:13,make feel good exactly wish people bad,AlvinTanYOLO,Sun,Mar,14,1
280,23:52:22,like play birthday come dear god leave strand make worth live fill gra,aderioju,Sun,Mar,14,1
281,23:50:56,mii swordfighter dedede smashville life worth live,TVenomoth,Sun,Mar,14,1
282,23:32:09,yes low status men low status achieve combine,tembian,Sun,Mar,14,1
283,23:24:26,prove worth get house use software data engineer longer prof,haHeyoka,Sun,Mar,14,1
284,23:22:56,seriously worth live earth kind expectations,realkennedync,Sun,Mar,14,1
285,23:20:21,even worth time talk sense everything res,None_of_a_kind_,Sun,Mar,14,1
286,23:16:53,burn popcorn life worth live like eat char bark handful shovel mouth,crappanappa,Sun,Mar,14,1
287,23:16:45,hmmm sure conversion round brass would worth,Colincombover1,Sun,Mar,14,1
288,01:21:25,ready jump bvs yet dive another league formation movie justice league war,TheErikSays,Mon,Mar,15,1
289,01:21:04,game ready jump bridge,TaySchlongz,Mon,Mar,15,1
290,01:20:10,usually fan problems tonight really edge specify time food,sjchan,Mon,Mar,15,1
291,01:19:35,stimmy shit get ppl depress bout ready end family shit elgmuzikgrewp,ELGKING,Mon,Mar,15,1
292,01:19:20,ready jump three movie whoop ass one right,veyondra,Mon,Mar,15,1
293,01:18:58,,citizenj17,Mon,Mar,15,1
294,01:18:43,pawar appear ready jump ship especially sachinvaze arrest,PanthilTweets,Mon,Mar,15,1
295,01:18:24,excite options already setup ready account thank much lovechase chasebank jpmorgan,Manning917,Mon,Mar,15,1
