,created_at,tweet,user_name,weekday,month,day,at_risk
5273,18:27:55,booklandreview star better dead glue start finish thank combination fast pace,eBooksHabit,Sun,Mar,14,1
5274,18:23:31,better team today race think get much dead wood kane look shatter,HBarnard96,Sun,Mar,14,1
5275,18:15:33,hayward better option sherman hope raiders play smart pay age vet,oaktownGreasy,Sun,Mar,14,1
5276,18:13:54,experience sort thing lot tell people extremely high expectations opene,ilyanep,Sun,Mar,14,1
5277,18:10:24,man really piss day fanatics better share opinion pie overrate dessert,seanjtaylor,Sun,Mar,14,1
5278,18:07:02,canada hold covid surge despite lag vaccinations,WatchForWorld,Sun,Mar,14,1
5279,18:04:31,many americans economists think would better less wealth dispari,Gladfly1,Sun,Mar,14,1
5280,18:02:23,make human interaction really good bother disgust neet like,kariminasa,Sun,Mar,14,1
5281,18:00:55,imagine dead silence like better kill brie larson,barnesfalcons,Sun,Mar,14,1
5282,18:00:27,imagine dead silence like better kill brie larson,rinalucid,Sun,Mar,14,1
5283,17:59:06,better dead,itizwoatitiz,Sun,Mar,14,1
5284,17:58:49,better makeup babypowder haloween make ghost somehow look less dead,MegzNO,Sun,Mar,14,1
5285,17:58:27,better dead,Clair_DeLunee,Sun,Mar,14,1
5286,17:57:39,ikram better dead,kilobatataa,Sun,Mar,14,1
5287,17:52:18,right use dead game population player count context time especially,vgkid415,Sun,Mar,14,1
5288,17:50:47,better dead better quitter say better ever,yolandakozitzki,Sun,Mar,14,1
5289,17:36:59,wrestle definitely better cornette finally dead,jmcchrist,Sun,Mar,14,1
5290,17:17:38,better dead one time faves,kimsuejenn,Sun,Mar,14,1
5291,17:15:19,america better dead rush limbergercheese,RocketRacer10,Sun,Mar,14,1
5292,17:10:41,every time see move get switch stay daylight time,DocLT2,Sun,Mar,14,1
5293,17:10:26,booklandreview star better dead glue start finish thank combination fast pace,eBooksHabit,Sun,Mar,14,1
5294,17:04:52,ever think want someone romantically realize really better friends,positively_bri,Sun,Mar,14,1
5295,17:00:41,everything thoughts wed ring better dead,Naaethan,Sun,Mar,14,1
5296,16:58:30,sorry word mess head yeah think better dead yeah,_dkstro,Sun,Mar,14,1
5297,16:48:40,,Gypsy_Grandma,Sun,Mar,14,1
5298,16:42:40,maximum get social security per month cap basically,odannyboy,Sun,Mar,14,1
5299,16:35:02,hey dont let people watch better dead right come man,bluenamicomin,Sun,Mar,14,1
5300,16:20:36,maybe better dead,qisfnd,Sun,Mar,14,1
5301,16:10:53,meds better dead say,pls_bemymistake,Sun,Mar,14,1
5302,16:08:17,abortion lie instead listen people within disability community loudly affirm,KevinKConroy,Sun,Mar,14,1
5303,16:08:05,fire station across party cousin take cool amp get ice pack,mookieaintcool,Sun,Mar,14,1
5304,16:06:56,better dead feature eddie van halen hamburger first time hear everybody want women,jcd823,Sun,Mar,14,1
5305,16:06:54,movie better dead john cusack come channel cleveland never,jcd823,Sun,Mar,14,1
5306,16:01:35,crack dead beat really find every excuse take accountability better,Talk_2_The_Star,Sun,Mar,14,1
5307,16:01:03,better dead,IgmaSigma,Sun,Mar,14,1
5308,16:00:40,voice head say better dead dont open vein freeze brain,Iouistmarvel,Sun,Mar,14,1
5309,15:58:56,booklandreview star better dead glue start finish thank combination fast pace,TheBookTweeters,Sun,Mar,14,1
5310,15:57:22,agree think get help would better take longer break able,LilBill_TooReal,Sun,Mar,14,1
5311,15:55:28,voice head tell better dead,lisanne76267640,Sun,Mar,14,1
5312,15:50:19,yall better leave alone argue piss matter time till bring,ExclusivelyRena,Sun,Mar,14,1
5313,15:49:46,booklandreview star better dead glue start finish thank combination fast pace,eBooksHabit,Sun,Mar,14,1
5314,15:49:31,line better dead,jsquared2k3,Sun,Mar,14,1
5315,15:43:01,gosh one time mine people ask funny enough stream higher,KalystC,Sun,Mar,14,1
5316,15:40:21,dunno get things right realistic innit better dead,MaximusQuirkus,Sun,Mar,14,1
5317,15:40:17,men embarrass hostage sir leave sure better,_mualoa,Sun,Mar,14,1
5318,15:36:44,album title better dead alias release next week via,__VDMR__,Sun,Mar,14,1
5319,15:25:21,since plane second away take livestream morning make exclusiv,SlowNewsDayShow,Sun,Mar,14,1
5320,15:13:41,two worst opinionists history country usa better get remove air,hot_rodddg19,Sun,Mar,14,1
5321,15:01:13,better place spend halloween underworld surround gods ghost monsters get hades,TaiyakiPress,Sun,Mar,14,1
5322,15:00:54,booklandreview star better dead glue start finish thank combination fast pace,eBooksHabit,Sun,Mar,14,1
5323,14:51:38,love god someone please kill lori stand bitch pregnant weak bitch,Downfall2020,Sun,Mar,14,1
5324,14:39:10,booklandreview star better dead glue start finish thank combination fast pace,TheBookTweeters,Sun,Mar,14,1
5325,14:38:48,know better dead,Yana45_,Sun,Mar,14,1
5326,14:34:57,deserve better whats better better boyfriend better dead cant tell,seeul8gator,Sun,Mar,14,1
5327,14:34:25,spur better buy,Austinforkeep,Sun,Mar,14,1
5328,14:32:26,one best movies ever better dead,simonsaysresist,Sun,Mar,14,1
5329,14:31:23,creaky elderly person nothing better still work full time amp,Gwen_Bayliss,Sun,Mar,14,1
5330,14:30:14,flatbush zombies better dead easily one best mixtapes time erick arc elliotts production,BeatsxOfficer,Sun,Mar,14,1
5331,14:27:02,tara piece inspire first book process sound,shannontakaoka,Sun,Mar,14,1
5332,14:26:50,english felt like many years,pevans666,Sun,Mar,14,1
5333,14:20:17,headcanon revive tommy start see ghost schlatt vilbur mexican dream torment,sIeepycrimeboy,Sun,Mar,14,1
5334,14:18:39,current mob govern police increasingly think would better one drown dead,HooklandGuide,Sun,Mar,14,1
5335,14:11:41,probably favorite john cusack movie even though absurd wacky,ClutchMilroy,Sun,Mar,14,1
5336,14:04:09,poor little thing thing better dead never smile,maryqueenofbots,Sun,Mar,14,1
5337,14:02:55,bite bullet learn figma last year much better move though,zaibuilds,Sun,Mar,14,1
5338,13:32:57,live better dead,smokieavalanche,Sun,Mar,14,1
5339,13:32:00,live better dead,The_Hemsley,Sun,Mar,14,1
5340,13:19:08,multiple time make sure dead media sure hear wou,DoniaEraiq,Sun,Mar,14,1
5341,13:14:34,everything thoughts wed ring better dead,muctarramen,Sun,Mar,14,1
5342,13:06:28,watch fncs day one nuzzle goat shit mero heal bugha clix dead,YungHenYT,Sun,Mar,14,1
5343,13:03:28,lucid dream move thing think bed everything thoughts,kaiquesm7,Sun,Mar,14,1
5344,13:02:37,adam sorry read hard better dead please reach,hClifford29,Sun,Mar,14,1
5345,12:50:17,want breathe want grow say want know work bleed beg pray,mcgrawclocks,Sun,Mar,14,1
5346,12:36:23,booklandreview star better dead glue start finish thank combination fast pace,eBooksHabit,Sun,Mar,14,1
5347,12:26:05,booklandreview star better dead glue start finish thank combination fast pace,TheBookTweeters,Sun,Mar,14,1
5348,12:22:30,better dead absolute classic,adolphsr,Sun,Mar,14,1
5349,12:16:58,sometimes better dead gun hand point head think,andiparry,Sun,Mar,14,1
5350,12:10:27,tbf support belief sense complicate patients die would feel guilty,ASortaHarvey,Sun,Mar,14,1
5351,11:58:22,sad read feel way adam know know defi,Jennid64,Sun,Mar,14,1
5352,11:49:33,fma better brotherhood even tho brotherhood base manga,CorNation1,Sun,Mar,14,1
5353,11:45:29,vaccine access birmingham would better way honor dead prevent unnecessary,Wait_tiaW,Sun,Mar,14,1
5354,11:32:19,better dead negative feel still whole life,emmacbrown88,Sun,Mar,14,1
5355,11:29:03,hate life without mum better dead,AdamJones442,Sun,Mar,14,1
5356,11:12:20,never saw better dead honestly believe ever even hear mig,shogunassassinn,Sun,Mar,14,1
5357,11:10:54,monster time low better dead jxdn,twirlysunsettt,Sun,Mar,14,1
5358,11:02:47,literally better dead lmao,ysiamf,Sun,Mar,14,1
5359,10:59:27,ppl continue say dimitri better dead lmao,machinistalisha,Sun,Mar,14,1
5360,10:54:33,passion let keep dark crypts soul lock inside head better dead,ayreon_txt,Sun,Mar,14,1
5361,10:17:27,better dead,Monique_Resists,Sun,Mar,14,1
5362,10:12:36,make realize better alone simply simply mark absence,juan_frann7,Sun,Mar,14,1
5363,09:57:00,people whilst unwell amp unwilling seek treatment cause horrendous harm survivors crimes,PaulEastabrook,Sun,Mar,14,1
5364,09:32:55,better dead,Avancws,Sun,Mar,14,1
5365,09:22:35,anti tamper mesh plugin kicad physical access electronics generally mean bet come,linuxdevices,Sun,Mar,14,1
5366,09:08:48,better dead,unknown11911,Sun,Mar,14,1
5367,08:59:10,respectfully say lol get sick foolishness sperm shit gettin outta hand,ms_amburrr,Sun,Mar,14,1
5368,08:59:03,diane franklin diane franklin better dead,modsnapradio,Sun,Mar,14,1
5369,08:44:14,maybe better dead,TheOneTheyLeft,Sun,Mar,14,1
5370,08:33:52,hate people cakap kenapa tak terjun nobody want die reason want pain stop bette,puteriasyura_,Sun,Mar,14,1
5371,08:12:38,suicide mention use razor take edge jump ledge say take laser,dayw4lkers,Sun,Mar,14,1
5372,08:00:01,better dead truth,albethough,Sun,Mar,14,1
5373,07:43:07,inmemoriam sorry report isidore mankofsky asc die age award win dop active,Zurabi17682134,Sun,Mar,14,1
5374,07:36:13,better dead cuz good person,gxth_angxl_sxn,Sun,Mar,14,1
5375,06:57:45,voice head say better dead,Woahsayduhh,Sun,Mar,14,1
5376,06:53:49,lucid dream move thing think bed everything thoughts,FlthySenpaii,Sun,Mar,14,1
5377,06:53:29,worthless better dead agree,euphoriaa_my,Sun,Mar,14,1
5378,06:44:01,need give rest see last days,BrentDa49382602,Sun,Mar,14,1
5379,06:20:08,think way lot hinata stans girls relate survive abusive environm,isntitlovelyz,Sun,Mar,14,1
5380,06:10:44,star trek star war sideways office space better dead vacation alien thing matrix sup,richksu,Sun,Mar,14,1
5381,06:09:41,tolerate man hit leave better single dead guy,Mureem97,Sun,Mar,14,1
5382,06:03:24,magnificent base better japanese movie,LongtermDM2020,Sun,Mar,14,1
5383,05:37:44,better dead,BlueBox_No_13,Sun,Mar,14,1
5384,05:28:05,better say father dead live mistress best friends wife already marry kid,innerthought121,Sun,Mar,14,1
5385,05:27:51,liars better dead,ImYour44116824,Sun,Mar,14,1
5386,05:22:56,better dead,bri4change2021,Sun,Mar,14,1
5387,05:18:00,one better thoughtful tweet however demonstrate lia,Gillythedog,Sun,Mar,14,1
5388,05:15:37,stg better dead,karl_me23,Sun,Mar,14,1
5389,05:14:17,worst anxiety always think someone care something hate live,aimracc,Sun,Mar,14,1
5390,05:03:06,better dead want,TTercjak,Sun,Mar,14,1
5391,04:50:02,better dead usually get people,markprel,Sun,Mar,14,1
5392,04:34:42,maybe better dead,vampiregutzzz,Sun,Mar,14,1
5393,04:34:22,better dead,Das_Fantastico,Sun,Mar,14,1
5394,04:30:56,single favorite movie many awesome ones risky business howard,ClutchMilroy,Sun,Mar,14,1
5395,04:14:41,bear lose say know better dead bear lose bad news get second chance,soporific_ed,Sun,Mar,14,1
5396,04:08:12,ppl continue say dimitri better dead lmao,mang0kitty,Sun,Mar,14,1
5397,04:06:20,honestly think better dead,dennougyaru,Sun,Mar,14,1
5398,04:01:47,may recommend better dead like perfect movie,Raynebow_Rayne,Sun,Mar,14,1
5399,03:59:14,better dead lol,effiesmind,Sun,Mar,14,1
5400,03:56:37,voice head say better dead open vein freeze brain,paula1nnit,Sun,Mar,14,1
5401,03:51:05,better dead love movie,DesireeRN76,Sun,Mar,14,1
5402,03:50:47,maybe better dead,idkicyy,Sun,Mar,14,1
5403,03:48:54,maybe better dead,gigistrapa,Sun,Mar,14,1
5404,03:47:37,stop stop feel air roc mic flipside love peedi crack dipset anthem really mean,MaskedMyles,Sun,Mar,14,1
5405,03:44:06,stop stop feel air roc mic flipside love peedi crack dipset anthem real,justpaulnow,Sun,Mar,14,1
5406,03:41:29,better dead rip acc,xFraags,Sun,Mar,14,1
5407,03:40:23,really btc dead point far dont mess actually bullish slower grin,CryptoWarrior_1,Sun,Mar,14,1
5408,03:40:03,better dead,Movies_Sales,Sun,Mar,14,1
5409,03:30:57,better dead great movie,parothed19741,Sun,Mar,14,1
5410,03:28:07,totally better dead believe,NotLennyBruce,Sun,Mar,14,1
5411,03:27:51,dancehall deck mic yell make much better,irvingkeys,Sun,Mar,14,1
5412,03:24:19,like live usa better dead severely ill,Kathlee15668430,Sun,Mar,14,1
5413,03:22:46,ahhh see need pixel sample render settings though sure,DukeGunston,Sun,Mar,14,1
5414,03:21:49,right age since see remember john lovely,Wadayaknow,Sun,Mar,14,1
5415,03:18:07,completely utterly better dead,lilc00chi,Sun,Mar,14,1
5416,03:13:46,better alone anyways,x_bolillo_x,Sun,Mar,14,1
5417,03:12:33,better dead,ScoutDaddy70,Sun,Mar,14,1
5418,03:09:47,,cinematossico,Sun,Mar,14,1
5419,03:06:26,better dead,TheRealResisty,Sun,Mar,14,1
5420,03:04:33,better dead,EricMWicks,Sun,Mar,14,1
5421,03:04:17,show hand never see better dead,Raynebow_Rayne,Sun,Mar,14,1
5422,03:02:40,maybe better dead,Alegarciaep,Sun,Mar,14,1
5423,02:58:57,watch better dead god love savage steve holland,Verisimlitudes1,Sun,Mar,14,1
5424,02:58:20,better dead,libertybell77,Sun,Mar,14,1
5425,02:51:40,sleep sirens better dead,Alegarciaep,Sun,Mar,14,1
5426,02:45:30,one favorite stories film oldman tell sound guy take,conescu,Sun,Mar,14,1
5427,02:42:40,everything think wed ring better dead,fijiky,Sun,Mar,14,1
5428,02:38:58,one already infect amp terrible job stay away,MatthewRimmer,Sun,Mar,14,1
5429,02:37:19,thank opinion definitely help trade get lot free,collindonnell,Sun,Mar,14,1
5430,02:37:04,see red red red gun head head head executioner style trial,HellsFireBurns,Sun,Mar,14,1
5431,02:36:06,hate people cakap kenapa tak terjun nobody want die reason want pain stop,ctrldoublec,Sun,Mar,14,1
5432,02:23:45,florida business scene better,KirinDave,Sun,Mar,14,1
5433,02:21:28,tell next month read book kindle unlimited need budget better sin,tasha71709,Sun,Mar,14,1
5434,02:11:00,nah liz better dead imprison theres come back psych,akocpatc,Sun,Mar,14,1
5435,02:07:01,better dead receive full stand ovation carter household tonight,SamuraiFlicks,Sun,Mar,14,1
5436,02:05:20,lrt honestly narrative person trauma better dead hard heal,nendoroit,Sun,Mar,14,1
5437,02:02:29,better dead say believe,scarijuana,Sun,Mar,14,1
5438,01:58:28,delivery company better rip restaurants low monthly ins,rakeshlobster,Sun,Mar,14,1
5439,01:58:16,carr mean sound really mean groupstalkers would netter dead world woul,TS_AlphaGoddess,Sun,Mar,14,1
5440,01:50:11,empire strike back spy love die hard better dead harry potter pris,healey793,Sun,Mar,14,1
5441,01:46:34,much better eat bacon machine gun think funniest ever even tho,carolinacurl,Sun,Mar,14,1
5442,01:43:39,pull gun tased time make different choice,jason31047,Sun,Mar,14,1
5443,01:38:47,better dead heathers pump volume although film,Brett,Sun,Mar,14,1
5444,01:37:25,around keep dog hat donkeys livestock ward coyotes,RavenJones_1,Sun,Mar,14,1
5445,01:32:57,might regret people say dak better true,1Sports_Fanatic,Sun,Mar,14,1
5446,01:19:27,head better dead sum,iiyougaku_bot,Sun,Mar,14,1
5447,00:39:39,know ring look much better dead person take kid,BIRDBRAlN,Sun,Mar,14,1
5448,00:29:31,dead ass better put lane unstable hell lil ass chair ghetto,KyrielikeIrving,Sun,Mar,14,1
5449,00:23:30,court sanction cameras would fix right better alive dead,psychetrick,Sun,Mar,14,1
5450,00:21:45,wan breathe wan say want dont know work bleed beg pray better dead,uwumenordetres,Sun,Mar,14,1
5451,00:20:51,cant afford breathe town nowhere sleep without gun head hook back cathod,uwumenordetres,Sun,Mar,14,1
5452,00:05:01,better dead know street value mountain,Timothy49396446,Sun,Mar,14,1
5453,23:58:01,probably think list right top head dead poets society,BentButterfly1,Sat,Mar,13,1
5454,23:49:34,club close kid dead hollywood better bed courtney find internet,trillaryklinton,Sat,Mar,13,1
5455,23:48:08,ableism murder filicide iterally stop convince parent kid better dead point,mikkelmish,Sat,Mar,13,1
5456,23:35:30,time top jon cusack movies particular order better dead tapeheads gross,miked213420,Sat,Mar,13,1
5457,23:31:24,walmart funny better dead character lot violent encounter lol rather,AuthorJStone,Sat,Mar,13,1
5458,23:30:10,cloudy chance anxiety keep demons inside maybe better dead,mell_honey_mell,Sat,Mar,13,1
5459,03:02:23,god plan plan commit suicide,Galacticsearace,Mon,Mar,15,1
5460,02:40:21,learn cope fix everyone cope lead drug use,MoscowPissCrime,Mon,Mar,15,1
5461,01:56:13,apparently thailand work tourism economy depression lockdown,napoleon21st,Mon,Mar,15,1
5462,18:40:34,reveal early version suicidesquad feature fight deathstroke,screenrant,Sun,Mar,14,1
5463,18:26:19,pick attack team set defend suicide weird game plan,lewisxmac,Sun,Mar,14,1
5464,17:54:42,god plan also jesus call god kill commit suicide,BbongoleDenis,Sun,Mar,14,1
5465,17:34:28,ltcs fill vaccinate patients certainly psychiatric patients lock,AureliaCotta,Sun,Mar,14,1
5466,17:27:35,remember jar joke film new joker scenes backyard back suicide squad come caus,ColdBloodedJoke,Sun,Mar,14,1
5467,17:16:51,last one one leave brutal scar potential smile,SundanceConstr1,Sun,Mar,14,1
5468,16:55:33,think kunikida detail plan get around longer human revive dazai eve,cressidasea,Sun,Mar,14,1
5469,16:48:45,mums women plan mums mums mums show question,Abberh_suicide,Sun,Mar,14,1
5470,16:48:39,could hire live suicide therapist like baby nurse,Mary28729751,Sun,Mar,14,1
5471,16:22:26,guy pregnant say alone start methodically plan suicide piers,xjaceyxc,Sun,Mar,14,1
5472,16:05:48,describe suicide bomber backup plan clearly describe,FranklinH3000,Sun,Mar,14,1
5473,16:03:09,think suicide bomber intent think blow,DeusExCinema,Sun,Mar,14,1
5474,15:30:00,past year see mentalhealth epidemic happen among children amp young adults,JohnBoydPsyD,Sun,Mar,14,1
5475,15:28:18,plan yes suicide,jeonztho,Sun,Mar,14,1
5476,14:50:19,time know stand gun hand gun hand longer ordinary,done_overrip,Sun,Mar,14,1
5477,14:49:30,sick thing suicide god plan everyone onl,AnnWill70032371,Sun,Mar,14,1
5478,14:08:04,plan debut hollywood open production house provide quality education children fullfill,Vaishna28289119,Sun,Mar,14,1
5479,14:05:59,plan debut hollywood open production house provide quality education children fullfill,its_me_SSRian,Sun,Mar,14,1
5480,13:15:19,suicide case someone love care need great resource writ,CaineMaxine,Sun,Mar,14,1
5481,12:37:45,yes yes yes,Preeti28040543,Sun,Mar,14,1
5482,12:16:37,plan burden anyone live limit capacity really want live,serpent_sky,Sun,Mar,14,1
5483,12:05:34,rape cannibalism male pregnancy force pregnancy human sacrifice suicide attempt suicide plan,smjs852,Sun,Mar,14,1
5484,12:00:50,,abhirash,Sun,Mar,14,1
5485,11:47:27,main things contribute think suicide clear plan even idea futur,DankAssPenguin,Sun,Mar,14,1
5486,11:25:28,mcu movies constantly top everything dcu measure fun quality fun,DailyJamesHibbs,Sun,Mar,14,1
5487,11:08:33,destructive decision boris block pit along carbon zero suicide plan,a_tethys,Sun,Mar,14,1
5488,10:29:46,providence suicide watch architecture writer david brussat tell really think yet anothe,RINewsToday,Sun,Mar,14,1
5489,08:01:03,one bin plan commit suicide long simply saw excuse justification,uduakbassey8,Sun,Mar,14,1
5490,07:34:52,amaze night thank everyone tune stream hope much,ViirusVIP,Sun,Mar,14,1
5491,07:10:38,plan suicide tell satan obliterate humanity,Chrisostomoto,Sun,Mar,14,1
5492,06:46:27,seriously consider suicide always try make friend always end alone plan close,kirasdaddy88,Sun,Mar,14,1
5493,06:00:01,suicide bomber explosives laptop board flight hop demolish whole plane,firstdoctorr,Sun,Mar,14,1
5494,05:32:33,reminder suicide safety plan free mobile app download onto android apple phone create,JaK7ltqoq3HJKFq,Sun,Mar,14,1
5495,04:26:43,suicide brain try kill wake every single morning passive suicidal,ScienceUnikerrn,Sun,Mar,14,1
5496,03:59:52,take one two national nuclear weapon laboratories,rapidlasso,Sun,Mar,14,1
5497,03:53:20,insurance plan cover suicide,cnctheworld,Sun,Mar,14,1
5498,03:47:37,shout secession without clear,khqlifa1,Sun,Mar,14,1
5499,03:46:24,,Rexys3rdEldest,Sun,Mar,14,1
5500,03:29:38,demonstration failure plan demonstration plan coordinate attack,VirginiaLoughn1,Sun,Mar,14,1
5501,02:50:46,commuters drive san francisco thursday night stick traffic chp investigate,209TimesCA,Sun,Mar,14,1
5502,02:48:34,leaders coach parent please plan join important panel discussion wednesday march,brandeetrout,Sun,Mar,14,1
5503,02:43:39,plan ayer suicide squad include fuck amaze plan studio scrap,harlsrobb1e,Sun,Mar,14,1
5504,02:00:32,artificialintelligence machine learn algorithm predict risk suicide attempt,CrosslinkerAi,Sun,Mar,14,1
5505,01:52:41,late husband famous shrink state person mention,sammyhoover1,Sun,Mar,14,1
5506,01:37:23,zak hausler know pain lose love one suicide involve extraordinary push mental health tra,TheTiserSport,Sun,Mar,14,1
5507,01:37:06,zak hausler know pain lose love one suicide involve extraordinary push mental,theTiser,Sun,Mar,14,1
5508,00:41:16,retirement plan suicide plan like people know,PoultryChamp,Sun,Mar,14,1
5509,23:34:29,royals amp royalists support archaic system need wake smell coffee tea inaction,Icandream1,Sat,Mar,13,1
5510,23:15:22,suicide stop pain pass someone else,Cheweychui,Sat,Mar,13,1
5511,23:11:36,late retweet show amaze thank great hear tune remember,TamerJeison,Sat,Mar,13,1
5512,22:58:50,liberal plan since healthy deserve live amp label,MarleneJF4,Sat,Mar,13,1
5513,22:34:00,prediction wayne couzens plan commit suicide prison trial innocent prove guilty court law,Edwardb66441470,Sat,Mar,13,1
5514,22:26:25,secret original creator company commit suicide jump golden gate bridge,esejohnp,Sat,Mar,13,1
5515,22:19:42,tweet every minute minutes ago hope make plan commit suicide please,amlosingweight,Sat,Mar,13,1
5516,22:17:59,assist patients experience heighten level stress anxiety get answer,PaulMiller1313,Sat,Mar,13,1
5517,22:14:44,murder suicide last week,joelazar69,Sat,Mar,13,1
5518,22:10:01,year leave london aupair nicest family friends many things,bokutoskohai,Sat,Mar,13,1
5519,22:04:48,add cherry top suicide verbiage,julesdelavasico,Sat,Mar,13,1
5520,21:57:43,gop scott want commit suicide plan,dallasrbaird,Sat,Mar,13,1
5521,21:57:26,wokeness society way commit suicide multiple,BuzzFakeNews,Sat,Mar,13,1
5522,21:25:54,suicide hopefully jinx suicidal feb march plan hea,kirstenrosiee,Sat,Mar,13,1
5523,21:07:55,sharon call context height second inti,downbytherive20,Sat,Mar,13,1
5524,21:06:53,want cuomo resign dont understand another confuse trump story wish would afte,danielt10439873,Sat,Mar,13,1
5525,21:00:33,recollections care suicidal teen devastate self inflict gunshot wind lead physician,docweighsin,Sat,Mar,13,1
5526,03:34:38,suicide pact,hobimuslim,Mon,Mar,15,1
5527,03:30:57,murder suicide pact men,lenny_liebmann,Mon,Mar,15,1
5528,03:18:23,civil war satish verma children wrath fire god watch subtle suic,jprapke,Mon,Mar,15,1
5529,03:16:50,amendment distraction question whether anyone foment violent seditious insurrection way saw,BenOSU66,Mon,Mar,15,1
5530,03:01:31,believe women mean victims sexual assault treat respect dignity crime investigate like,guyfawkestoo,Mon,Mar,15,1
5531,02:40:15,believe women mean victims sexual assault treat respect dignity crime investi,HwRogue,Mon,Mar,15,1
5532,02:36:00,hey favorite voice hear chirp phone hey reply begin walk,BreezeWrites_,Mon,Mar,15,1
5533,02:37:51,suicide pact,hnylecoj,Sun,Mar,14,1
5534,02:21:28,funny enough isiais abiy stitch,DanSegue,Sun,Mar,14,1
5535,02:08:35,still cringe fact part suicide pact,Versace_Poptart,Sun,Mar,14,1
5536,01:45:55,suicide pact day without lookin fuck trashcan sus,MDick2012,Sun,Mar,14,1
5537,01:45:06,someone say suicide pact,Filth_MD,Sun,Mar,14,1
5538,00:49:55,damn super lame basically sign suicide pact people like end,Isildurmon,Sun,Mar,14,1
5539,00:22:05,ridiculous headline obviously intend hey republicans please click article change,malasadasbooks,Sun,Mar,14,1
5540,00:20:20,suicide pact,KVennie,Sun,Mar,14,1
5541,23:55:02,ridiculous headline obviously intend hey republicans please click article,faith_jvs,Sat,Mar,13,1
5542,23:08:57,omg form suicide pact together bestie,BonannoCat,Sat,Mar,13,1
5543,22:43:18,suicide pact,jonnymuzik,Sat,Mar,13,1
5544,22:33:32,sound like gop prepare suicide pact,CALUSA18,Sat,Mar,13,1
5545,22:12:12,suicide pact girls,jingosgee_,Sat,Mar,13,1
5546,22:11:32,suicide pact girls,bilbobaggz2,Sat,Mar,13,1
5547,22:05:17,bill right suicide pact talk challenge address domestic terrorism,RoZsaJH,Sat,Mar,13,1
5548,20:27:05,could suicide pact wwx say tentatively perhaps man back later,paragayyy,Sat,Mar,13,1
5549,20:12:36,suicide pact,Playboyjxcob,Sat,Mar,13,1
5550,19:54:19,disclosure also educate others universality suicide risk nobody immune whether live,DrNidaMirza,Sat,Mar,13,1
5551,19:27:16,yeah remember leave planet suicide attempt rome courtney stretcher upset,SanFranDamn,Sat,Mar,13,1
5552,19:24:13,text picture trigger warn reshared suicide prevention month reminder affordab,KareemMAlston,Sat,Mar,13,1
5553,19:23:17,sampson use fact lose bet excuse become mass,PeterCorless,Sat,Mar,13,1
5554,19:22:12,want cuomo resign dont understand another confuse trump story wish would,steven94117,Sat,Mar,13,1
5555,19:18:24,agree except bee bee movie gurl want make suicide pact problem,Katie63592922,Sat,Mar,13,1
5556,18:58:39,case curious operate fundamental misunderstand tegmark quantum suicide think,KirinDave,Sat,Mar,13,1
5557,18:56:04,mcafee end accidentally suiciding fundamental misunderstand nature quantum,KirinDave,Sat,Mar,13,1
5558,18:16:23,western media develop convenient amnesia misrepresent china anti terrorism program news article abo,xifeng1842,Sat,Mar,13,1
5559,17:50:06,constitution suicide pact one cancel constitution crisis,TinPotDickTator,Sat,Mar,13,1
5560,17:33:35,suicide pact,MetalXSlug,Sat,Mar,13,1
5561,17:19:21,wasnt suicide shit know better dead worry chillen heaven hell big,OFFICIAL_DUBON,Sat,Mar,13,1
5562,16:40:24,depression suicide,JenniferSey,Sat,Mar,13,1
