,created_at,tweet,user_name,weekday,month,day,at_risk
2692,02:07:28,ruby better hire fitzpatrick take couple kill goodgirls,bossbxtchs,Mon,Mar,15,1
2693,02:07:05,like imma throw stairs kill mfs crack,la__duch,Mon,Mar,15,1
2694,02:06:47,dis hoe tell kill guess wat leave voicemail shoot gun air drop phone,Askaboutmariii,Mon,Mar,15,1
2695,02:06:41,matter still love bts see scammys ugh kill,HEYSTOB24991126,Mon,Mar,15,1
2696,02:06:33,wan fuck kill want commit suicide see,ArcaneDoom,Mon,Mar,15,1
2697,02:05:51,kill black swan,pinkchemicaIs,Mon,Mar,15,1
2698,02:05:42,freedom eos price get manipulate would kill sure,block_zero_,Mon,Mar,15,1
2699,02:05:41,kill,44punishedcind,Mon,Mar,15,1
2700,02:05:20,take back play musical kill listen another bts song,dietttbread,Mon,Mar,15,1
2701,02:05:15,kill vibe,BLlNGEE,Mon,Mar,15,1
2702,02:04:43,like positive would deadass kill courage,honeyhottpot,Mon,Mar,15,1
2703,02:04:35,reki think break good keep try manipulate langa rockin,ayuslilac,Mon,Mar,15,1
2704,02:04:22,may actually kill vaccinate,kalingcriss,Mon,Mar,15,1
2705,02:04:17,could kill,contogrotesco,Mon,Mar,15,1
2706,02:03:56,wan kill sometimes,o2ldepartment,Mon,Mar,15,1
2707,02:03:29,wan kill,PortlandInFour,Mon,Mar,15,1
2708,02:03:22,bts lose kill,abby0xox,Mon,Mar,15,1
2709,02:03:12,want kill ever,byenashie,Mon,Mar,15,1
2710,02:02:18,buzzfeed show anthony mackie gon kill back,winterfalcon13,Mon,Mar,15,1
2711,02:01:58,year anniversary covid long hauler syndrome vaccine option body,thestolenolive,Mon,Mar,15,1
2712,02:01:51,work want kill cos ruin day bye hope die mad,apricotmonday,Mon,Mar,15,1
2713,02:01:37,kill,ilyjanis,Mon,Mar,15,1
2714,02:01:30,lol think actually block mistake due homophobic followers tell,th3hatt3r1,Mon,Mar,15,1
2715,02:01:28,bagus gue linguistik might well kill,nakamotorrr,Mon,Mar,15,1
2716,02:01:23,gon kill swear give taylor something youre sick,glittersniff,Mon,Mar,15,1
2717,02:01:19,tweet reason ima kill,lord_bezos,Mon,Mar,15,1
2718,02:01:18,let kill,flopgod_,Mon,Mar,15,1
2719,02:01:04,gon kill,dorotheasbetty,Mon,Mar,15,1
2720,02:01:03,imagine constipation carry big shit months develop tiktok fanatic would kill lol,timarofl,Mon,Mar,15,1
2721,02:00:27,desire deal political potential riot threats ensue,RemanScimitar,Mon,Mar,15,1
2722,02:00:09,hot gon kill,yyyuuuhhhhhhh,Mon,Mar,15,1
2723,01:59:50,normally huge fear players cause die actively,rtddWill,Mon,Mar,15,1
2724,01:59:19,really want hair braid look ugly ima kill,KYxAriel,Mon,Mar,15,1
2725,01:58:22,ponies panic claim game would kill xbox fact help,InfamousLiberal,Mon,Mar,15,1
2726,01:57:30,bestie kill everyone around,windermerepeakx,Mon,Mar,15,1
2727,01:56:53,friends say theres always tomorrow like bro ima kill tonight,BnnQuit,Mon,Mar,15,1
2728,01:56:30,kill grandma sad,VVIPallRed,Mon,Mar,15,1
2729,01:56:18,kill come back bury beg bitch,Real_PoloBands,Mon,Mar,15,1
2730,01:56:07,gon kill,zenagaib,Mon,Mar,15,1
2731,01:55:41,kill fault,s4rayuu_,Mon,Mar,15,1
2732,01:55:08,wish new upstairs neighbor would kill daydream ways becau,queen_reality,Mon,Mar,15,1
2733,01:55:05,phone ever die house would kill,gbyayaspazz,Mon,Mar,15,1
2734,01:54:51,kill fault,frogcel,Mon,Mar,15,1
2735,01:54:27,cartman side god seriously gon kill right run heidi eric run,heidibot_en,Mon,Mar,15,1
2736,01:54:22,sorry tell kill know express lol,Tacobellaella,Mon,Mar,15,1
2737,01:53:54,ask think kill,Katsu_agiota,Mon,Mar,15,1
2738,01:53:37,emma stone gon kill,javiciastanatic,Mon,Mar,15,1
2739,01:53:16,try harder could something smh take answer try make bad imma kill,domo_ocam,Mon,Mar,15,1
2740,01:53:09,think parent fight court kill know,gemstonemario,Mon,Mar,15,1
2741,01:52:25,tell kill everybody love,halfdeadartst,Mon,Mar,15,1
2742,01:52:22,ride die kill hoe love lmao,ameliafordart,Mon,Mar,15,1
2743,01:52:11,good governor amp free state try also remind every winter tha,WhitegirlTokin,Mon,Mar,15,1
2744,01:52:10,want kill bad lol,Picklemaddierix,Mon,Mar,15,1
2745,01:51:59,omg like even need ffs already pretty wan kill every time look forehead,nmonksteel,Mon,Mar,15,1
2746,03:10:38,suicide note,swag_haver_1483,Mon,Mar,15,1
2747,03:07:02,suicide note,fartingonu,Mon,Mar,15,1
2748,02:33:56,next person say look like edna incredibles write suicide note,bunniesora,Mon,Mar,15,1
2749,02:22:07,pack find suicide note hide mom find stuff two years ago feel pog,piss_in_me,Mon,Mar,15,1
2750,02:19:14,esp estwillbe leave attempt succeed mite,martinegilbert7,Mon,Mar,15,1
2751,21:17:43,write suicide note,nyotaikawife,Sat,Mar,13,1
2752,21:16:58,remember read jonghyun suicide note first time realise similar word,English_maze,Sat,Mar,13,1
2753,21:00:34,egregious medical error leave debilitate pain aunt force taper,Colo_Trumpette,Sat,Mar,13,1
2754,20:59:51,snap lecture hat today nothing write sizzle bullet point inject sales,zic_toti,Sat,Mar,13,1
2755,17:43:51,spray suicide note chanel,5corpiusss,Sat,Mar,13,1
2756,17:38:52,use washroom diner drop duece suicide note,nutsaremixed,Sat,Mar,13,1
2757,17:26:01,suicide note,yoorify,Sat,Mar,13,1
2758,17:20:06,aaron would suicide note make endgame scenes last season felt,diIfshepherd,Sat,Mar,13,1
2759,17:11:26,gon shoot put tsc suicide note,bethany_roseeee,Sat,Mar,13,1
2760,16:51:58,link suicide note curious cat main bcuz curious cat link profile nobody woul,tragicccomedy,Sat,Mar,13,1
2761,16:15:09,big account love fake suicide note everything take little break,teufeIa,Sat,Mar,13,1
2762,15:57:44,like idc idgaf write suicide note,isabelpinto000,Sat,Mar,13,1
2763,15:51:10,believe suicide note drop people start regret,SamuelJohnOkor1,Sat,Mar,13,1
2764,15:33:20,use washroom diner drop duece suicide note,occupied_stall,Sat,Mar,13,1
2765,15:31:56,papa one main reason still try even though already verge hurt kill,jyllflrs,Sat,Mar,13,1
2766,14:50:27,feel comfy share detail weird reason happy wake try wake cryi,jnj_bunny_stan,Sat,Mar,13,1
2767,13:25:08,realise befrienders actually reply suicide note lol,M4RE3YA,Sat,Mar,13,1
2768,13:09:39,leave fents name suicide note,TAFcps,Sat,Mar,13,1
2769,12:08:12,make pancakes forget syrup suicide note,bbritt8x,Sat,Mar,13,1
2770,08:37:07,teachers refuse put grade email suicide note life hack,k8edtwt,Sat,Mar,13,1
2771,07:45:22,kill write suicide note,aquaseuI,Sat,Mar,13,1
2772,06:06:04,suicide note,Jembrii,Sat,Mar,13,1
2773,05:54:36,one write suicide note senior year shit,CandeCucci,Sat,Mar,13,1
2774,04:14:49,suicide note mla format,fyodorkys,Sat,Mar,13,1
2775,04:00:55,whoever unfollowed hope know ruin week whenever look follower count look wrong,rebeccayona02,Sat,Mar,13,1
2776,02:53:12,thx suicide note,yoorify,Sat,Mar,13,1
2777,01:41:23,write new song see come pen word saw suicide note,killwebkinz,Sat,Mar,13,1
2778,00:00:32,make way see things cover interpret suicide note,deluludere,Sat,Mar,13,1
2779,23:37:19,drop suicide note,petrol1984,Fri,Mar,12,1
2780,23:14:55,holy shit yeah check suicide note,MightBeStupid,Fri,Mar,12,1
2781,22:18:39,think suicide note lot one write couple years back one write today wan,Zuhrona3,Fri,Mar,12,1
2782,21:32:55,well suicide note,ClaireP58827267,Fri,Mar,12,1
2783,21:16:50,cry taco bell remove nacho fry definitely suicide note,laylacore,Fri,Mar,12,1
2784,20:54:14,imply suicide suicide mention rate people move note,HarbingerArt,Fri,Mar,12,1
2785,20:17:14,suicide little sister leave mom suicide note school run know know,WONTOPlA,Fri,Mar,12,1
2786,19:18:36,put name suicide note,dazehan,Fri,Mar,12,1
2787,18:51:04,gon suicide note,johnbollozos,Fri,Mar,12,1
2788,18:32:46,could mom would still make could write suicide note fau,Imbabychulo,Fri,Mar,12,1
2789,18:05:00,gon write suicide note invisible ink cuz shit gon embarrass,aaronp_39,Fri,Mar,12,1
2790,16:49:34,suicide note say body temple atheist kill bhenchod,BawalBailly,Fri,Mar,12,1
2791,16:42:14,anyone will proofread suicide note would hate demise accuse bad spell punctuation,SLayton82,Fri,Mar,12,1
2792,16:21:14,suicide note deny charge state sex consensual flee england felt,Arron2Smith,Fri,Mar,12,1
2793,15:59:42,next person say something voice suicide note,BRAlNMATT3R,Fri,Mar,12,1
2794,14:47:11,god dead slash throat double,Xxa4A,Fri,Mar,12,1
2795,13:35:33,lose incredibly talented little brother able build anything could envis,s_2_th_honda,Fri,Mar,12,1
2796,12:39:23,suicide note mid night leave world hop find better world,aveghuleh,Fri,Mar,12,1
2797,12:26:11,remember year two ago would think would put suicide note think separat,animegirlspitt,Fri,Mar,12,1
2798,10:50:53,find body believe suicide note,thyhighnest,Fri,Mar,12,1
2799,09:41:27,join shakily sketch nail paint emoji suicide note tweet,SweatieAngle,Fri,Mar,12,1
2800,09:12:09,next person talk get call name suicide note,trinmb16,Fri,Mar,12,1
2801,08:45:26,tweet find mention career suicide note fosho,ArrreBawa,Fri,Mar,12,1
2802,08:24:45,senior quote suicide note,MoniSuperiority,Fri,Mar,12,1
2803,08:23:16,senior quote suicide note,mattgoodwinREE,Fri,Mar,12,1
2804,07:54:17,next person offer charity pity mention name suicide note,onlywaterinfrst,Fri,Mar,12,1
2805,07:48:08,suicide note,myocrocs,Fri,Mar,12,1
2806,05:45:55,next person talk get call name suicide note,ChristensenT24,Fri,Mar,12,1
2807,05:22:47,ever write suicide note would cum paper put freezer sperm could,emokidwith,Fri,Mar,12,1
2808,04:27:48,picture include suicide note entry,snartgrips,Fri,Mar,12,1
2809,04:03:30,suicide note,drmwtic,Fri,Mar,12,1
2810,03:01:38,silver line decent person family dead fling around much vitriol want suicide note,oedibussy,Fri,Mar,12,1
2811,03:00:29,tweet suicide note,teresaiiana,Fri,Mar,12,1
2812,02:53:27,krista vernoff get namechecked suicide note,danisolisfc,Fri,Mar,12,1
2813,02:53:11,krista vernoff get namechecked suicide note,leopvrdskin,Fri,Mar,12,1
2814,02:35:08,kill leave suicide note blame tekun infuriate fire alarm keep ring,aimikacin,Fri,Mar,12,1
2815,01:59:11,call friend read suicide note like year ago think funny think,me4tgrinder,Fri,Mar,12,1
2816,01:37:48,dot whisper dresser right next suicide note,SondLloydWebBot,Fri,Mar,12,1
2817,01:29:25,make suicide note,yoorify,Fri,Mar,12,1
2818,01:09:44,pretty sure coworkers read tweet get work everyday also might delusional,periodbloodboi,Fri,Mar,12,1
2819,00:36:49,dresser right next suicide note andrew lloyd webber,SondLloydWebBot,Fri,Mar,12,1
2820,00:24:25,make cut would consider bear killer still aggin faith untouchabl,boliver36,Fri,Mar,12,1
2821,00:05:45,wish dms tell daily commit suicide,BornForFiN,Fri,Mar,12,1
2822,22:46:48,know say force give appreciate sympathetic message suicid,3nityDiary,Thu,Mar,11,1
2823,22:46:16,know say force give appreciate sympathetic message suicid,3nityDiary,Thu,Mar,11,1
2824,22:29:55,suicide note send mom,_demartinz,Thu,Mar,11,1
2825,22:17:39,suicide note,yoorify,Thu,Mar,11,1
2826,22:17:09,love music first song find suicide note dark time life,POTENTMUSIC01,Thu,Mar,11,1
2827,22:16:43,write regular checkups ecg night would enough must lie suicide note,dumbovli,Thu,Mar,11,1
2828,21:53:54,put mhy suicide note,VampKlaha,Thu,Mar,11,1
2829,21:16:57,rewatched aquaman one point fightclub reference fight club star jar leto jar leto play,EverRester,Thu,Mar,11,1
2830,19:58:30,hang start play dababy name drop suicide note congratulations reason,pebuut,Thu,Mar,11,1
2831,19:47:55,feel free express opinion shud end,AhayahAsha4,Thu,Mar,11,1
2832,19:39:46,snap lecture hat today nothing write sizzle bullet point inject mor,zic_toti,Thu,Mar,11,1
2833,19:02:15,gon turn suicide note instead miss assignments anymore,kaamiilllaaa,Thu,Mar,11,1
2834,18:18:12,kinda dark sometimes back read suicide note leave behind see something else like,aIterangel,Thu,Mar,11,1
2835,18:17:25,suicide note,yoorify,Thu,Mar,11,1
2836,17:57:58,want give big shout fix felix excerpt suicide note,squidwardhousee,Thu,Mar,11,1
2837,17:51:35,gon turn suicide note instead miss assignments anymore,r444wr,Thu,Mar,11,1
2838,17:49:52,twitter mutual someone post suicide note,Im_a_Jarhead,Thu,Mar,11,1
2839,17:25:35,sorry hear aunt cate,sonarhack,Thu,Mar,11,1
2840,16:39:48,sign suicide note kiss,heavengalore,Thu,Mar,11,1
2841,16:27:05,would never write suicide note thoughts justice would leave ques,dead50857486,Thu,Mar,11,1
2842,16:21:04,old nephew attempt suicide january nights hospital last year,Tracey69327123,Thu,Mar,11,1
2843,15:34:26,think write suicide note physics whole new level low lmao,jjuIian,Thu,Mar,11,1
2844,14:22:35,saw joke tone ask suicide note suicide note mean,LANX1CHEN,Thu,Mar,11,1
2845,13:36:54,review jesus christ superstar dresser right next suicide note detroit news,SondLloydWebBot,Thu,Mar,11,1
2846,13:30:07,gon suicide note,ojsimsponalt,Thu,Mar,11,1
2847,13:05:43,print image suicide note,genderBiohazard,Thu,Mar,11,1
2848,12:43:37,gon suicide note,thot_tactics,Thu,Mar,11,1
2849,11:40:01,box memories amp find suicide note read ooft,amselizabeth__,Thu,Mar,11,1
2850,11:17:03,even dey owe school note note omo suicide thing,_theolokun,Thu,Mar,11,1
2851,10:35:11,tell sister day put suicide note bully,weird_gal_pal,Thu,Mar,11,1
2852,10:17:58,suicide note read could longer explain joke,MirManal1,Thu,Mar,11,1
2853,09:59:21,powerful event still home night break write suicide note whatsapp statu,SommyIncrease,Thu,Mar,11,1
2854,07:53:33,old nephew attempt suicide january nights hospital last year,JCadeCirca1450,Thu,Mar,11,1
2855,07:19:03,write name death note murder suicide neither,cvtiegyu,Thu,Mar,11,1
2856,06:56:44,write suicide note hello kitty stationary,fatcummiess,Thu,Mar,11,1
2857,05:43:49,well yes really know choice know dad talk,rusty_p4n_626,Thu,Mar,11,1
2858,04:49:56,currently plan suicide note algebra,g4rb4dge,Thu,Mar,11,1
2859,04:47:05,followers fuckfing shakinf sweat thank god fuck post ass fina,matzahluvr,Thu,Mar,11,1
2860,03:51:00,mother attempt suicide leave journal note father,Psychocyka,Thu,Mar,11,1
2861,03:22:28,pray one day able chuck suicide note bin completely happy majority tim,Mizikiyana,Thu,Mar,11,1
2862,03:16:38,suicide write note,itsbians,Thu,Mar,11,1
2863,02:09:02,think kms would nice put cat gif online suicide note,d1nolbs,Thu,Mar,11,1
2864,02:08:27,end suicide note girlboss,NAOMlCORE,Thu,Mar,11,1
2865,01:49:22,die suicide note full shit emotional wri,SweetyNingombam,Thu,Mar,11,1
2866,01:03:58,post suicide note social media continue day like nothing,teenhorrorfiIms,Thu,Mar,11,1
2867,00:59:49,suicide careful tweet future employers gon see gon see gay,razorkisser,Thu,Mar,11,1
2868,00:57:49,suicide actually jump deep end gon write note things make,seokieblossom,Thu,Mar,11,1
2869,00:26:25,think nonstop day wan say last years depressio,skinnymommaa,Thu,Mar,11,1
2870,00:25:55,write genshin suicide note,xingyunkys,Thu,Mar,11,1
2871,00:09:32,therapy convince therapist kill despite half assedly,kenobeavfd,Thu,Mar,11,1
2872,00:00:33,end suicide note girlboss,imoffacidat711,Thu,Mar,11,1
2873,22:46:45,call bestie juno literally blame suicide note,liudiet,Wed,Mar,10,1
2874,22:12:56,suicide note say anything fake murder,xxycalico,Wed,Mar,10,1
2875,21:35:50,overfill trash much tip piece old suicide note glue face floor soda,SAV3Y0URS3LF_,Wed,Mar,10,1
2876,21:28:49,write suicide note get covid vaccine,Thebetterlifee,Wed,Mar,10,1
2877,21:12:30,update suicide note life like resume,punkhepburn,Wed,Mar,10,1
2878,21:10:45,suicide suicide note gon carrd,emofvcker,Wed,Mar,10,1
2879,21:00:57,time write suicide note goodbye,EddieGorm,Wed,Mar,10,1
2880,20:16:59,listen baby shark solid hours suicide note juicy bbw real home,RedSuper7,Wed,Mar,10,1
2881,20:09:25,reason would save plan include link suicide note,suitstuffer,Wed,Mar,10,1
2882,19:46:08,like people need say everything story come ask proof read,FanVonbuskirk,Wed,Mar,10,1
2883,19:43:31,like people need say everything story come ask proof read suicide note,timeless_swag1,Wed,Mar,10,1
2884,18:35:38,years since mom decide convert use disability excuse rob,whoknows0o0,Wed,Mar,10,1
2885,18:25:58,leave suicide note tell kent police look laws business,martinegilbert7,Wed,Mar,10,1
2886,18:12:01,also find video source cite section suicide note,TristanIsOnline,Wed,Mar,10,1
2887,18:10:15,nikocado avocado thing suicide note,mavislikesfob,Wed,Mar,10,1
2888,17:50:37,rain weekend tweet suicide note,rototots,Wed,Mar,10,1
2889,17:19:39,last book review second woman review novel first woman sorry admire,aliner,Wed,Mar,10,1
2890,16:50:50,last book review second woman review novel first woman sor,kmahaj,Wed,Mar,10,1
2891,15:33:08,sorry partially understand torment first husband die due suicide know,CourtneyAuntie,Wed,Mar,10,1
2892,14:46:10,facts look want prove suicidal get,JacquisBackup,Wed,Mar,10,1
2893,14:27:55,tmobile get shout suicide note,blacklizted13,Wed,Mar,10,1
2894,14:20:34,narcissistic father texted suicide note week ago fine narcissist want,woah_mothy,Wed,Mar,10,1
2895,14:17:37,friend leave suicide note doorstep early morning along bunch things life fuck pointless,gittyalt,Wed,Mar,10,1
2896,14:14:47,aswear demma consolation med suicide note,GhanaRonaldo,Wed,Mar,10,1
2897,10:42:34,sure hell person make grammatical spell mistake suicide note,noorie_31,Wed,Mar,10,1
2898,09:50:42,write suicide note alphabetie spaghetti hang noose make cheesestrings,Robertdcopland,Wed,Mar,10,1
2899,08:22:06,mention name personally suicide note,LongLiveTheChef,Wed,Mar,10,1
2900,08:18:13,morning draft call suicide note note empty know,_fuckingfranco,Wed,Mar,10,1
2901,08:06:43,terrible nightmare dream answer call phone phone touch face acc,WatsonDynamite,Wed,Mar,10,1
2902,06:39:39,abt write first suicide note funsies,skinnymommaa,Wed,Mar,10,1
2903,05:02:17,thank guy much respond suicide note,hamdullah_gamer,Wed,Mar,10,1
2904,04:48:08,still suicide note phone read time time remind far come read whil,_phatbratzdoll,Wed,Mar,10,1
2905,04:42:40,good job bro speed middle stormy night drink obscure song reference pre,AverageGuy977,Wed,Mar,10,1
2906,03:58:14,today one farmer name rajveer singh age village sisayh district hisar commit suicide write,Bharat96774871,Wed,Mar,10,1
2907,03:45:03,guess nobody tell dad suppose read suicide note dead,applejuicewpulp,Wed,Mar,10,1
2908,03:35:43,still suicide note phone read time time remind far come,demeemia,Wed,Mar,10,1
2909,03:29:44,kill suicide note twitter login expect girls tweet draft,guidojuicee,Wed,Mar,10,1
2910,02:52:53,next person offer charity pity mention name suicide note,iKingCarnage,Wed,Mar,10,1
2911,02:42:55,heathers suicide make suicide note one heathers srs,chilledpenguin3,Wed,Mar,10,1
2912,02:19:01,second hand embarrassment major plot point suicide note,achoirofmute,Wed,Mar,10,1
2913,01:53:22,suicide note mla format,sexyfartgirl,Wed,Mar,10,1
2914,01:51:23,govt blood hand many people another farmer commit suicide today write suicide,kingkong20207,Wed,Mar,10,1
2915,01:48:02,next person offer charity pity mention name suicide note,tardisludgate,Wed,Mar,10,1
2916,01:41:19,idk man drop suicide note block something really saw happen,ayothebrat,Wed,Mar,10,1
2917,01:13:37,one faith sweatshop tell dont love cause suicide note mean something,faifhump,Wed,Mar,10,1
2918,00:33:30,safe place basically say cause one follow lol label suicide,therealsnr,Wed,Mar,10,1
2919,00:13:48,come home note door neighbor commit suicide gun know neighbor,UmarLeeIII,Wed,Mar,10,1
2920,21:25:27,make note everyone facebook slag meghan suicidal next time,ShadowBullets24,Tue,Mar,9,1
2921,21:13:25,mention suicide note,Factorman15,Tue,Mar,9,1
2922,21:11:57,suicide need figure lyric band want note ever find,downfalltome,Tue,Mar,9,1
2923,20:33:39,emily must suicide note,AnarkittyEmily,Tue,Mar,9,1
2924,20:31:02,draw barrymore admit favourite mcdonald sandwich filet fish people actually applaud con,BryanHatt,Tue,Mar,9,1
2925,20:30:02,patron name suicide note,HWSB_2,Tue,Mar,9,1
2926,20:14:03,damn write recent suicide note year ago today never,aquablueneptune,Tue,Mar,9,1
2927,20:05:59,threaten put phoebe bridgers new version kyoto top suicide note like myspace profile,IittIebeast,Tue,Mar,9,1
2928,20:02:47,never invite space cuz stutter suicide note,gowons,Tue,Mar,9,1
2929,19:36:25,wednesday year old beloved daughter diagnosis eupd make real suicide,SiobhanHayesSH,Tue,Mar,9,1
2930,18:54:20,suicide third wave covid suicide note,AceofblazeX,Tue,Mar,9,1
2931,18:32:51,suicide gon kms leave note,koreanclownery,Tue,Mar,9,1
2932,18:32:11,suicide gon kms leave note,catboyh8er,Tue,Mar,9,1
2933,18:29:21,suicide note pink balloon format,cloth_gowns,Tue,Mar,9,1
2934,18:04:40,btw nearly fell flight stairs moments send tweet think facto,ChristFinnegan,Tue,Mar,9,1
2935,17:48:06,find funny mutuals priv literally give fuck probably twee,TWiNKBOYSUNOO,Tue,Mar,9,1
2936,17:13:55,seriously still know george sanders suicide note heart even though,BangableGnome,Tue,Mar,9,1
2937,16:59:02,let drop suicide note let world know push early grave,temiOmari,Tue,Mar,9,1
2938,16:53:37,say hope get note bitch yeah leave suicide door bitch,stopgassingmid,Tue,Mar,9,1
2939,16:24:59,may put name suicide note anymore,kentosite,Tue,Mar,9,1
2940,15:10:21,self part immediately think someone force hye write suicide,tzukims,Tue,Mar,9,1
2941,15:05:29,last day school ima email teachers tell leave back send summer school,iiamnahh1,Tue,Mar,9,1
2942,15:01:44,patron name suici,essex_lc,Tue,Mar,9,1
2943,13:29:49,fault sorry think word describe apologetic wish,nextlife_x,Tue,Mar,9,1
2944,12:31:34,god write blood suicide note,_BMTHbot,Tue,Mar,9,1
2945,11:59:35,suicide literally want alive anymore think note leave morning,fairyca1,Tue,Mar,9,1
2946,11:45:42,arnab arrest base suicide note leave late anvya naik,BySushant,Tue,Mar,9,1
2947,11:24:26,want shoutout suicide note,charlottesdick,Tue,Mar,9,1
2948,10:53:26,days precede breakdown hit write suicide note decide place method,tfirstelizabeth,Tue,Mar,9,1
2949,09:34:21,father die suicide monday love brother deeply support endeavor would reliabl,LaoluOgunlana,Tue,Mar,9,1
2950,09:15:29,name drop suicide note david block twitter time thats straw,Bug_burps,Tue,Mar,9,1
2951,08:38:50,put nft suicide note,KinskyUnplugged,Tue,Mar,9,1
2952,07:31:52,everyone post get decide someone else suicidal remind,thatspookybabe,Tue,Mar,9,1
2953,07:27:21,know artists live schizophrenia dont think make hard finally tell dad,vawidowo,Tue,Mar,9,1
2954,07:24:20,fall side life believe decision whether live die think suicide,LadyWrites,Tue,Mar,9,1
2955,07:00:27,grandma kill camp grind everyone think murder find suicide note,is_mangle,Tue,Mar,9,1
2956,06:55:31,call bother tell come home say tell cause able drive,MackdaddyDr,Tue,Mar,9,1
2957,06:06:42,suicide gon kill deadass gon put suicide note,griffinsjake,Tue,Mar,9,1
2958,05:37:30,ima feature suicide note,renv6nge,Tue,Mar,9,1
2959,05:30:37,one day successfully put suicide note nais fault,maidceI,Tue,Mar,9,1
2960,05:30:05,one day successfully put suicide note nais fault,iBAlZHU,Tue,Mar,9,1
2961,04:57:43,early morning meet best surely find space suicide note,NonCreativeTwit,Tue,Mar,9,1
2962,04:45:00,share poem come dark time life maybe someone relate,WxOxD,Tue,Mar,9,1
2963,04:19:44,hate ones ever gon laugh joke suicide note cuz stay strong fair,downbadbruce,Tue,Mar,9,1
2964,03:58:05,resume read like worlds first rational suicide note,justmichaelman,Tue,Mar,9,1
2965,03:52:56,really relate people like write friends suicide note tand see actually,lHoneycals,Tue,Mar,9,1
2966,03:24:30,video suicide note supermario dworld bowsersfury nintendoswitch,TradmascReplica,Tue,Mar,9,1
2967,03:11:44,tell promise implicate suicide note say note sell short,DanielleStarry,Tue,Mar,9,1
2968,02:35:46,happen first bullet point suicide note,LoganGiesman11,Tue,Mar,9,1
2969,01:40:32,donate patreon ill put name suicide note,monas_china,Tue,Mar,9,1
2970,00:59:47,please mate something terrible sure mind seem like suicide note,thebottomcorna,Tue,Mar,9,1
2971,00:23:42,wish could back years old friends play good grade,skinbyflume,Tue,Mar,9,1
2972,23:59:32,suicide cross mind almost daily decades years ago thoughts,IowaHeretic,Mon,Mar,8,1
2973,23:44:15,suicide note probably something like sorry guy never felt alive,NNNihilistic,Mon,Mar,8,1
2974,23:07:28,dee tee twt come ranboo put suicide note,ranbcc,Mon,Mar,8,1
2975,23:04:51,make kamala write stevebucky fan fic marvel actually kill blame writers,ANIDALASCENT,Mon,Mar,8,1
2976,23:03:10,dee tee twt come ranboo put suicide note,pinkallium,Mon,Mar,8,1
2977,22:36:10,write suicide note kiss butterfly live tonight choose die,michaeldrevnak,Mon,Mar,8,1
2978,22:11:04,mention every stranger enter mention try correct name suicide note,kommiekaze,Mon,Mar,8,1
2979,21:59:42,leave note hallway time read far away far away suicide see tear fall eye,ItsGPereira,Mon,Mar,8,1
2980,21:07:04,haryanvi farmer rajveer singh village sisayh district hisar commit suicide father boy gir,whojdsingh,Mon,Mar,8,1
2981,19:05:49,self harm suicide online best friend fake suicide note say follow,birdybones13,Mon,Mar,8,1
2982,18:48:05,death suicide literally plan death get day estimate time age suicide,KurtsCumSlut,Mon,Mar,8,1
2983,18:41:01,suicide die anytime soon would wear suicide note shirt hon,KurtsCumSlut,Mon,Mar,8,1
2984,18:39:37,wan turn suicide note swear fire,ThatXVGuy,Mon,Mar,8,1
2985,18:34:51,make kamala write stevebucky fan fic marvel actually kill blame writers,petersanakin,Mon,Mar,8,1
2986,18:16:57,viewpoint main reason labour party commit suicide immigrat,AlbertNormand3,Mon,Mar,8,1
2987,18:01:29,write suicide note speak,ghibIijk,Mon,Mar,8,1
2988,17:27:42,public suicide attempt think happen know need,ChelsEllen,Mon,Mar,8,1
2989,16:20:00,long time come need get homeless camp clean one,ron_hannink,Mon,Mar,8,1
2990,16:12:39,hope get note bitch aye leave suicide door bitch,LaFlare1_,Mon,Mar,8,1
2991,15:58:06,last leave daughter write note suspense daughter commit suic,NaveenM81817950,Mon,Mar,8,1
2992,15:51:25,eruri one suicide note,krrpton,Mon,Mar,8,1
2993,15:13:32,suffer depression kid father sexually abuse contemplate suicide even,comgeek25,Mon,Mar,8,1
